time,title,author
2021-06-01T10:34:00+02:00,De la vidéosurveillance pour assurer la quiétude de Droixhe,Michel Gretry
2021-06-01T08:07:28+02:00,La banque Triodos va financer des projets culturels en Belgique à hauteur de 50 millions d'euros,Belga
2021-06-01T08:15:00+02:00,Stib et neutralité : le goût amer de la défaite,Bertrand Henne - Les coulisses du pouvoir
2021-06-01T08:46:37+02:00,Coronavirus en France : les Français ont épargné 142 milliards d'euros de plus que d'habitude,AFP
2021-05-31T11:57:00+02:00,Test PCR gratuit côté Français : beaucoup de Belges passent la frontière pour le réaliser,Vincent Clérin avec Denis Vanderbrugge
2021-05-31T11:58:11+02:00,Etats-Unis : les démocrates sabotent l’adoption d’une loi sur le droit de vote au Texas,Belga
2021-05-31T12:08:55+02:00,Coronavirus : la Belgique donnera 4 millions de doses au programme de coopération internationale COVAX,Belga
2021-05-31T12:15:00+02:00,Liège: deux soeurs se lancent dans une action de solidarité en faveur des plus démunis,Martial Giot
2021-05-31T12:20:31+02:00,Coronavirus : la moitié des Belges de 18 ans et plus ont reçu au moins une dose de vaccin (graphiques interactifs),Ambroise Carton
2021-05-31T12:34:43+02:00,Un suspect interpellé après la mort d'une femme en pleine rue à Evere dimanche soir,Belga
2021-05-31T12:57:03+02:00,"Offensive à Gaza : une plainte déposée devant la CPI vise six responsables israéliens, dont Benjamin Netanyahou",Daniel Fontaine
2021-05-31T13:06:51+02:00,Les pays membres acceptent de réformer et renforcer l'OMS,Belga
2021-05-31T13:27:47+02:00,La Banque Nationale demande aux banques de soutenir la reprise économique en octroyant des crédits,"Jean-François Noulet, avec Belga"
2021-05-31T14:00:00+02:00,"Plans d'eau, rivières... Voici la nouvelle carte des zones de baignade de plein air en Wallonie",Am.C.
2021-05-31T14:29:25+02:00,Accident de téléphérique en Italie : le directeur technique dit ne rien savoir des pinces qui ont bloqué le système de freinage,Belga
2021-05-31T14:39:39+02:00,Des B-52 américains survolent lundi le territoire des trente pays de l’Otan,Belga
2021-05-31T15:44:48+02:00,Bangladesh : des milliers de Rohingyas dénoncent leurs conditions de vie sur une île battue par les cyclones,Belga
2021-05-31T15:55:25+02:00,"Police : selon l’organe de contrôle, la qualité des bases de données policières laisse à désirer",Belga
2021-05-31T15:12:55+02:00,Moscou veut discuter avec Biden des droits humains et de l’assaut du Capitole,Belga
2021-05-31T16:34:19+02:00,"Sri Lanka : l’équipage d’un porte-conteneurs en feu depuis 12 jours interrogé, désastre écologique en cours",Belga
2021-05-31T16:09:49+02:00,Déconfinement et voyage : Malte rejoint les destinations classées en zone verte,Belga
2021-05-31T16:36:05+02:00,De 0 à 470 euros : combien coûte un test PCR dans les pays européens ?,A. T.
2021-05-31T16:47:32+02:00,"Crise sanitaire en Belgique : Pierre Wunsch (BNB) et Thomas Dermine (PS) invités d'un ""kern"" sur la situation économique",Belga
2021-05-31T16:42:00+02:00,De plus en plus de chiens et de chats obèses : une clinique spécialisée leur ouvre ses portes,Pascale Bollekens
2021-05-31T16:18:04+02:00,"Déconfinement et aéronautique : les affaires de Lufthansa redécollent, la compagnie sort une cinquantaine d'avions du hangar",Belga
2021-05-31T16:53:26+02:00,Coronavirus en Iran : le pays franchit la barre des 80.000 décès,Belga
2021-05-31T17:14:03+02:00,"Le préservatif ""anti-viol"", une fausse solution qui renforce les croyances et mythes autour du viol",Adeline Louvigny
2021-05-31T17:23:14+02:00,République tchèque : la police demande au parquet d’inculper le Premier ministre Babis pour fraude,Belga
2021-05-31T17:08:53+02:00,"Affaire Dupont de Ligonnès : décès de Guy Joao, le retraité pris il y a deux ans à tort pour le fugitif",Belga
2021-05-31T17:41:56+02:00,Mortalité dans le monde : plus du tiers des décès dus aux canicules sont attribuables au changement climatique,Belga
2021-05-31T16:59:14+02:00,"Justice : résoudre son conflit en évitant la case tribunal, des avocats pour vous y aider",Patrick Michalle
2021-05-31T17:48:46+02:00,Les étangs de Recht à nouveau repris comme zone de baignade autorisée,Olivier Thunus
2021-05-31T17:54:31+02:00,"Autriche : l’ex chef de l’extrême droite sera jugé pour corruption (affaire de l'""Ibizagate"") début juillet",Belga
2021-05-31T18:09:40+02:00,"Plan de relance wallon : le ministre Jeholet prêt à discuter ""sans tabou"" d’une réforme de la formation en alternance",Belga
2021-05-31T18:27:09+02:00,"Schaerbeek : ondes brouillées, voitures ""visitées""",RTBF Bruxelles
2021-05-31T18:34:26+02:00,"Journée mondiale sans tabac : interdire de fumer dans les aires de jeu et les parcs, une bonne stratégie ?",P.V.
2021-05-31T18:35:00+02:00,Un an de prison avec sursis pour un ancien notaire montois coupable de fraude,Belga
2021-05-31T18:43:54+02:00,Comment rendre le palais des Princes-Evêques aux liégeois ?,Michel Gretry
2021-05-31T18:30:42+02:00,Coup d’Etat au Mali : le colonel Goïta rentre conforté de son double coup de force,Belga
2021-05-31T18:47:16+02:00,Des concerts de musique classique organisés au centre de vaccination du Heysel,Belga
2021-05-31T18:17:33+02:00,Vaccination en Europe : la Commission approuve le vaccin BioNTech/Pfizer pour les 12-15 ans,Belga
2021-05-31T18:48:06+02:00,Namibie : les ethnies Héréro et Nama rejettent l’accord de réparation avec l’Allemagne pour le génocide (1904-1908),Belga
2021-05-31T19:12:21+02:00,L’ancienne commanderie liégeoise des chevaliers teutoniques est vendue,Michel Gretry
2021-05-31T19:32:54+02:00,En est-ce fini de la quiétude des riverains d’Xhovémont ?,Michel Gretry
2021-05-31T19:41:16+02:00,Coronavirus et économie : un manque à gagner de 30 millions d'accises sur la bière l'an dernier,Belga
2021-05-31T19:34:19+02:00,"#Protectmanonolita : vaste mouvement de soutien à Manon, streameuse belge, victime de menaces de mort et de viol",RTBF
2021-05-31T20:19:00+02:00,"Conflit israélo-palestinien : le Hamas prêt à des pourparlers ""rapides"" pour un échange de prisonniers avec Israël",Belga
2021-05-31T19:53:15+02:00,Eruption volcanique en RDC : la diaspora congolaise en Belgique se mobilise pour aider la population de Goma,Belga
2021-05-31T20:30:06+02:00,"CQFD : Israël sans Benyamin Netanyahu, est-ce possible ?",Wahoub Fayoumi
2021-05-31T20:31:51+02:00,"Nucléaire iranien : selon un rapport, le chef de l'AIEA serait ""préoccupé"" par des sites non déclarés",Belga
2021-05-31T19:04:49+02:00,Avion dérouté par le Biélorussie : L’Otan réduit l’accès des diplomates biélorusses à son siège bruxellois,Belga
2021-05-31T20:33:11+02:00,"La STIB, condamnée pour double discrimination, ne fait pas appel : va-t-elle autoriser les signes convictionnels, comme le demande le jugement ?",A. Louvigny & P. Carlot
2021-05-31T20:44:36+02:00,Islande : la surface des glaciers de l'île ont reculé de 750 km2 en vingt ans,Belga
2021-05-31T21:02:22+02:00,Liège : la Ville envisage toujours de déposer sa candidature au titre de Capitale de la Culture 2030,Belga
2021-05-31T21:24:25+02:00,"Coronavirus et lexique : ne dites plus variant ""britannique"" mais variant ""alpha""... l'OMS simplifie son vocabulaire",K.D. - Belga
2021-05-31T22:53:45+02:00,"""Une couverture vaccinale entre 80 et 90% serait idéale"" estime Muriel Moser, immunologue à l’ULB",Hugues Angot
2021-05-31T21:45:43+02:00,Coronavirus au Pérou : Lima réévalue le nombre des morts dans le pays de 69.000 à 180.000,Belga
2021-05-31T22:55:57+02:00,"La douleur des rescapés 100 ans après le massacre raciste de Tulsa aux États-Unis : ""J'entends encore les avions nous survoler""",Maxime Fettweis
2021-06-01T06:00:11+02:00,Identifier un inconnu en quelques secondes : comment les algorithmes se nourrissent des photos trouvées sur internet,Am.C. avec Agences
2021-05-31T23:07:42+02:00,Les aéroports européens alertent d'un potentiel chaos estival dû aux contrôles Covid-19,Belga
2021-06-01T06:36:29+02:00,Les recettes fiscales récoltent les fruits de la reprise économique,Belga
2021-06-01T06:30:00+02:00,"Le parquet européen entame sa chasse à la fraude ce mardi : ""Il n’y a pas de pays propre""",Myriam Baele
2021-06-01T06:56:09+02:00,"La filiale américaine de JBS, un des leaders du secteur de la viande, victime d'une cyber-attaque",Belga
2021-06-01T06:27:41+02:00,"L'ex-ministre australien Mathias Cormann, né en Belgique, à Eupen, prend la tête de l'OCDE",Belga
2021-06-01T06:57:18+02:00,Arabie saoudite: un ministre veut baisser le volume des haut-parleurs des mosquées lors de l'appel à la prière,AFP
2021-06-01T07:07:25+02:00,Possibles abus sexuels dans une école à Woluwe-Saint-Lambert : les parents appellent au calme,Belga
2021-06-01T07:00:00+02:00,France : les apiculteurs inquiets par les vols de ruches,Adeline Percept
2021-06-01T07:47:01+02:00,Afrique de l'Ouest: farine et huile de poisson privent les populations d'aliments,Belga
2021-06-01T08:00:37+02:00,Plan de relance: l'Union européenne peut démarrer son processus de dette commune,AFP
2021-06-01T07:13:07+02:00,"Au coeur d'une crise diplomatique entre l'Espagne et le Maroc, le chef du Polisario entendu par un juge",AFP
2021-06-01T09:13:47+02:00,"L’unique usine d’Hannut va disparaître, la capsulerie fera place à des appartements",Françoise Dubois
2021-06-01T09:16:10+02:00,Désherbant à base d’acide acétique : du vinaigre à prix d’or,Christine Lenaerts
2021-06-01T09:18:16+02:00,"Italie: la libération du parrain mafieux Giovanni Brusca, après 25 ans de prison, provoque l'indignation",Belga
2021-06-01T10:05:38+02:00,Russie : de nombreux opposants arrêtés suite à de nombreuses perquisitions,Belga
2021-06-01T09:47:51+02:00,"Des tests PCR gratuits à l'aube des vacances ? ""On va essayer de trouver un équilibre"" assure Eva De Bleeker",Maxime Fettweis
2021-06-01T10:08:47+02:00,Revue de presse : la vaccination a pris sa vitesse de croisière,La revue de presse de Nicolas Vandenschrick
2021-06-01T10:22:03+02:00,"Le président du parlement wallon, Jean-Claude Marcourt serait-il rattrapé par l'affaire Nethys ?",Michel Gretry
2021-06-01T10:21:12+02:00,"Coronavirus en Belgique ce mardi 1er juin 2021 : la baisse se confirme pour tous les indicateurs, même dans les provinces où ça ""traînait""",RTBF
2021-06-01T10:22:28+02:00,"Le Liban subit une crise économique parmi les pires au monde depuis 1850, selon la Banque mondiale",AFP
2021-06-01T10:27:17+02:00,Coronavirus en Belgique : suivez en direct le point presse du Centre interfédéral de crise dès 11 heures,Africa Gordillo
2021-05-31T08:11:00+02:00,Gosselies : le collège Saint Michel fermé une semaine pour cause de cluster Covid,Christine Borowiak
2021-05-31T11:43:12+02:00,"France : l'ex-militaire en fuite a été interpellé et neutralisé, annonce le ministre de l'Intérieur",AFP
2021-05-31T07:57:49+02:00,Signes convictionnels : une seule décision de justice ne peut faire jurisprudence selon le ministre Clerfayt,Belga
2021-05-31T08:03:35+02:00,"Coronavirus : la Wallonie lance ce lundi l'opération ""Re Vax 50+"" pour convaincre les hésitants",Belga
2021-05-29T15:53:31+02:00,Vers la fin de la vaccination avec AstraZeneca en Belgique ?,Belga
2021-05-29T16:14:46+02:00,Des médecins appellent à une action mondiale contre les risques liés au climat devant le siège de l'OMS,AFP
2021-05-29T14:40:17+02:00,"RDC : ""fausse alerte"", il n'a pas de seconde éruption selon le gouvernement",AFP
2021-05-29T17:06:00+02:00,Une ou deux doses de vaccin pour les personnes ayant fait un covid ? Le Conseil supérieur de la santé se dirige vers un avis plus nuancé,Lucie Dendooven
2021-05-29T16:49:43+02:00,La FGTB veut permettre certaines prépensions dès 58 ans,Belga
2021-05-29T17:15:54+02:00,"Au centre-ville, 1500 personnes en lutte pour les soins de santé, ""on ne se sent pas entendus""","M.-L.M., F. C. et J. I."
2021-05-29T17:08:05+02:00,Une naissance sur cinq est donnée par une mère isolée,N.J.
2021-05-29T13:43:11+02:00,"A Bruxelles, le personnel des soins de santé veut dire son ras-le-bol et appelle à une refonte du secteur",M. A.
2021-05-29T17:44:53+02:00,Manifestation à l'ambassade bélarusse à Bruxelles pour le journaliste Raman Pratasevich,Belga
2021-05-29T17:30:35+02:00,Chine : escapade en haut d’une tour de télé pour touristes en manque d’adrénaline,AFP
2021-05-29T19:15:45+02:00,"Un concert en Floride cinquante fois plus cher pour les personnes non vaccinées : ""C'est une décision commerciale""",AFP
2021-05-29T19:29:14+02:00,"Espagne : un cargo chavire dans le port de Castellon, deux portés disparus et trois blessés",Belga
2021-05-29T17:59:49+02:00,Covid: Indochine en concert à Bercy avec 5000 personnes pour faire avancer la science,AFP
2021-05-29T18:28:00+02:00,Eruption du volcan Nyiragongo : le déplacement de milliers de personnes de Goma à Bukavu inquiète des ONG,A.D.
2021-05-29T19:41:15+02:00,Partir en croisière et faire escale dans un port d'Espagne ? Ce sera à nouveau possible le 7 juin,Belga
2021-05-29T21:58:51+02:00,Colombie : envoi de l'armée à Cali où les manifestations font dix morts de plus,Belga
2021-05-29T20:25:14+02:00,"Coronavirus en Belgique : un adulte sur deux a reçu une dose de vaccin, vers un ""retour à la normale"", se félicite Alexander De Croo",Belga
2021-05-30T07:00:00+02:00,"Reptiles autorisés, remboursement des lunettes, certificat ""eau"" : ce qui change en juin",A. Lechien
2021-05-30T07:10:02+02:00,"Boris Johnson se marie ""en secret"", selon les médias britanniques",AFP
2021-05-30T07:39:10+02:00,"Décès du chanteur B.J. Thomas, chanteur de ""Raindrops Keep Fallin' On My Head""",Belga
2021-05-30T07:43:44+02:00,"Mort à 90 ans de l'acteur Gavin MacLeod, capitaine de ""La croisière s'amuse""",Belga
2021-05-30T07:28:50+02:00,La journée Chantiers ouverts débute en ligne ce dimanche et pendant tout le mois de juin,Belga
2021-05-30T09:13:35+02:00,Pandémie en Inde: une crise alimentaire pour des millions de personnes,AFP
2021-05-30T09:22:19+02:00,Le Français Benjamin Brière détenu en Iran en attente d'un procès pour espionnage,AFP
2021-05-30T07:50:39+02:00,Brésil : nouvelles manifestations anti-Bolsonaro,Belga
2021-05-30T09:49:15+02:00,"Incendie à bord d'un ferry indonésien: 274 personnes secourues, un disparu",AFP
2021-05-30T08:06:03+02:00,Pas de Boum 3 samedi soir dans les parcs de Bruxelles,Belga
2021-05-30T10:17:06+02:00,Coronavirus en Belgique ce dimanche 30 mai 2021 : les admissions à l’hôpital passent sous la barre des 90,RTBF
2021-05-30T11:35:42+02:00,"France : chasse à l’homme en Dordogne pour retrouver un ancien militaire lourdement armé, recherché après des violences",Belga
2021-05-30T11:32:43+02:00,"Boom des achats de villas de luxe à Dubaï, refuge pour échapper aux confinements",AFP
2021-05-30T09:53:16+02:00,Affaire Jürgen Conings : les unités spéciales ont mené des fouilles dans la région Zutendaal cette nuit,Belga
2021-05-30T12:20:15+02:00,Israël : vers la fin de l’ère Netanyahu ? Les tractations politiques s’intensifient,AFP
2021-05-28T16:42:45+02:00,Protection des données : Test Achats met fin à l'action collective contre Facebook suite à un accord,Belga
2021-05-28T15:05:05+02:00,Vêtements pour enfants : quand ils peuvent représenter un danger,Isabelle Huysen
2021-05-28T14:56:52+02:00,"Pour la ministre flamande de l’Environnement, la Défense est responsable des dégâts de l’incendie de Brecht",Jean-François Noulet
2021-05-28T15:28:00+02:00,Arrêtés ministériels Covid 19 : les Bourgmestres wallons en ont marre d’attendre,Jean-François Noulet
2021-05-28T15:26:06+02:00,Hannut: profs et élèves déguisés pour les 100 jours des rhétos,Natacha Mann
2021-05-28T16:01:33+02:00,Deux Islandais au sommet de l'Everest malgré une infection au coronavirus,Belga
2021-05-28T15:11:00+02:00,"Voici la future piscine olympique de Louvain-la-Neuve: sobre, très économe en énergie et pour tous les publics (photos)",Hugues Van Peel
2021-05-28T15:53:42+02:00,L'ancien patron de la Commission des Jeux de hasard poursuivi pour avoir incité au hacking,Belga
2021-05-28T16:06:32+02:00,Le coussin pour chien : un endroit refuge indispensable,On n'est pas des pigeons
2021-05-28T16:13:23+02:00,Roumanie : l'avion et la limousine de l'ancien dictateur Ceaucescu vendus aux enchères,Belga
2021-05-28T16:38:05+02:00,Les chauffeurs Uber manifestent à Bruxelles : Rudi Vervoort promet une concertation dès que le plan taxi sera déposé,Belga
2021-05-28T16:47:00+02:00,"Ghlin: malgré les interventions, la teinte du ""ruisseau bleu"" est toujours présente",Belga
2021-05-28T16:28:12+02:00,"""Google sait mieux que vous quand vous allez mourir"": la santé est un marché très rentable pour les GAFAM",Lavinia Rotili
2021-05-28T16:47:55+02:00,Marchés publics truqués: prison ferme pour le sénateur français Jean-Noël Guérini,Belga
2021-05-28T16:41:06+02:00,L’Agence européenne des médicaments approuve l’usage du vaccin de Pfizer pour les adolescents de 12 à 15 ans,Johanne Montay
2021-05-28T17:09:47+02:00,Soins de santé et la Boum 3: les manifestations animeront Bruxelles samedi,Belga
2021-05-28T17:07:53+02:00,"300 euros par mois pour des petits-déjeuners, est-ce bien raisonnable ? La Première ministre finlandaise dans le collimateur",Frédéric Faux
2021-05-28T17:17:00+02:00,"Anderlecht, Wemmel, Dilbeek, Jette,..: le boum entendu en région bruxelloise venait de deux F-16 à la recherche d’un avion civil","X.L., avec B. Hupin"
2021-05-28T17:18:09+02:00,USA: les hackers derrière le piratage de SolarWinds lancent de nouvelles attaques,AFP
2021-05-28T17:27:00+02:00,Plusieurs départements de France repassent en zone orange : qu'est-ce que cela change pour vos vacances ? (carte interactive),Maxime Fettweis
2021-05-28T17:14:14+02:00,"Pour l'OMS, la pandémie ne sera terminée que lorsque 70% de la population mondiale sera vaccinée",Belga
2021-05-28T17:25:50+02:00,Attentat de London Bridge: défaillances des autorités dans le suivi du terroriste Usman Khan,Belga
2021-05-28T18:00:00+02:00,"Saint-Ghislain: mécontentement du personnel de Texaco, une rencontre avec la direction est prévue le 17 juin",Belga
2021-05-28T17:49:00+02:00,Avion dérouté par la Biélorussie : les vols Belavia entre Charleroi et Minsk annulés jusqu'au 31 octobre,Belga
2021-05-28T18:07:33+02:00,Woluwe-Saint-Lambert : enquête ouverte sur de possibles abus sexuels à l'école Floralia,Belga
2021-05-28T18:12:51+02:00,Le quotidien L'Avenir fera peau neuve le 1er juin,Belga
2021-05-28T18:17:11+02:00,Assassinat de Julie Van Espen : le principal suspect se rapproche d'un procès en assises,Belga
2021-05-28T18:23:13+02:00,Viktor Orban reçu à Londres sur fond de controverse,Belga
2021-05-28T18:19:52+02:00,Incendie à Bozar : le gouvernement lance un marché public pour les travaux de réparation critiques,Belga
2021-05-28T18:39:58+02:00,"Vaccins contre le coronavirus: Emmanuel Macron d'accord pour une suspension des brevets, l'Afrique du sud applaudit",AFP
2021-05-28T18:47:14+02:00,"USA: Joe Biden renonce à revenir dans le traité ""Ciel ouvert"" et s'en prend à la Russie",Belga
2021-05-28T18:39:00+02:00,Coronavirus : la Maison de la Culture d'Arlon recherche une centaine de participants pour un spectacle test,Maxime Maillet
2021-05-28T17:53:00+02:00,Le génocide pour la première fois reconnu par un Etat européen à l'époque des colonies : un dangereux précédent ?,Lucie Dendooven
2021-05-28T19:12:45+02:00,Canada: les restes de 215 enfants retrouvés sur le site d'un ancien pensionnat,Belga
2021-05-28T19:20:56+02:00,La politique de recrutement de l'administration fédérale assouplie,Belga
2021-05-28T19:05:22+02:00,"Poutine reçoit le président biélorusse après l'affaire de l'avion détourné : ""Nous sommes en train de construire une Union""",Belga
2021-05-28T19:25:26+02:00,La SNCB prévoit des trains supplémentaires vers la Côte ce week-end,Belga
2021-05-28T19:17:24+02:00,Insurrection à Washington : les républicains bloquent une commission sur l'assaut du Capitole,Belga
2021-05-28T19:36:30+02:00,Des soldats américains révèlent des secrets nucléaires en révisant leurs connaissances en ligne,AFP
2021-05-27T14:38:25+02:00,Il y a moins de 500 patients Covid en soins intensifs ce jeudi : une étape importante pour déconfiner,Am.C.
2021-05-27T15:11:19+02:00,"Sûreté de l’Etat, SGRS, OCAM : qui fait quoi en matière de renseignements en Belgique ?",RTBF
2021-05-27T15:36:02+02:00,"Selon Reporters sans Frontières, la situation des journalistes est ""désastreuse"" en Biélorussie",Belga
2021-05-27T15:51:07+02:00,"Le Premier ministre s’explique sur le report du Comité de concertation, alors que l’Horeca et d’autres secteurs attendent des précisions",Jean-François Noulet
2021-05-27T16:16:15+02:00,Allocation GRAPA : les contrôles domiciliaires sont suspendus jusqu’en septembre,M-P. J. avec M. A.
2021-05-27T16:11:16+02:00,Facebook ne va plus bannir les théories selon lesquelles le Covid-19 proviendrait d'un laboratoire,AFP
2021-05-27T16:37:37+02:00,"Cyberattaque: les hackers n'ont pas eu accès à des données personnelles ou classifiées, selon le Premier ministre",RTBF avec Belga
2021-05-27T16:20:15+02:00,"Un vol Vienne-Moscou annulé faute d'autorisation russe pour éviter le Bélarus, selon la compagnie Austrian Airlines",AFP
2021-05-27T16:43:00+02:00,Canal Bruxelles-Charleroi: la dépollution aux hydrocarbures se poursuit,RTBF
2021-05-27T16:47:26+02:00,Avion dérouté par le Bélarus : aucune preuve de la présence d'agents du KGB dans l'avion détourné,Belga
2021-05-27T17:08:54+02:00,Thromboses et vaccins contre le Covid-19 : une nouvelle piste d’explication,Johanne Montay
2021-05-27T17:11:00+02:00,"Le Grand Manège dévoile le ""Namur Concert Hall"" (Visite & Photos)",Benjamin Brone
2021-05-27T16:38:55+02:00,"La vaccination des moins de 41 ans avec Johnson & Johnson suspendue pour les publics précarisés en Wallonie, mais reprend vendredi à Bruxelles","Johanne Montay, Jennifer Istace, Martin Caulier, Ambroise Carton"
2021-05-27T17:01:00+02:00,"Industrie et climat : aux Pays-Bas, Shell contraint de s'aligner sur l'accord de Paris, la porte ouverte à d'autres procès ?",Kevin Dero
2021-05-27T17:12:00+02:00,Explosion de la rue Léopold : le propriétaire de l'immeuble ira en cassation,BELGA
2021-05-27T17:20:48+02:00,Une action de grève touchera des pompes Texaco ce vendredi,Belga
2021-05-27T17:31:59+02:00,"Le patron d'Arianespace dénonce le ""risque de monopolisation"" de l'espace par SpaceX",Belga
2021-05-27T17:40:14+02:00,Iran: nouvelle condamnation pour une militante des droits humains,Belga
2021-05-27T17:21:14+02:00,Eradication de milliers d’écrevisses de Louisiane à Chaumont-Gistoux : une première en Belgique,Sarah Heinderyckx
2021-05-27T18:02:53+02:00,Waremme : un sursis pour le camp de migrants du bois de la Haute Wegge,Martial Giot
2021-05-27T17:52:00+02:00,Jürgen Conings : des balises placées par la ministre Dedonder pour engager des réformes avec les syndicats,Patrick Michalle
2021-05-27T18:22:00+02:00,"""Tous les jours, à l'aube, je vais nager"" : portrait d'une nonagénaire qui n'a pas peur de se mouiller",Sophie Mergen & Alexis Gonzalez
2021-05-27T18:19:29+02:00,Chute de téléphérique en Italie : le garçonnet survivant s'est réveillé,Belga
2021-05-27T18:31:40+02:00,Le véhicule de Jürgen Conings était piégé et présentait des risques de violentes explosions,RTF avec Belga
2021-05-27T18:06:50+02:00,Coronavirus : la Wallonie lance trois nouveaux mécanismes de soutien aux indépendants et aux PME,Belga
2021-05-27T18:29:15+02:00,La FSMA et la BNB devront dénoncer les montages fiscaux particuliers,Belga
2021-05-27T19:02:00+02:00,Ils avaient infligé des sévices graves à un autre jeune: des Tournaisiens condamnés à de la prison ferme,Belga
2021-05-27T19:00:00+02:00,Coronavirus : faudra-t-il ajouter 8 heures de procédures à l'aéroport à la durée de son vol ?,Philippe Antoine
2021-05-27T19:44:31+02:00,Afrique du Sud: Jacob Zuma à nouveau condamné à payer des frais de justice,Belga
2021-05-27T20:08:24+02:00,Coronavirus : la Belgique a commandé 23 millions de doses pour une troisième injection,Belga
2021-05-27T20:20:27+02:00,Coronavirus : l'Allemagne va ouvrir la vaccination aux mineurs de plus de 12 ans en juin,Belga
2021-05-27T20:14:54+02:00,Vaste opération anti-drogue : deux autres travailleurs du port d'Anvers interpellés dans l'enquête sur Sky ECC,Belga
2021-05-27T21:16:23+02:00,KLM renonce au licenciement de 700 personnes,Belga
2021-05-27T21:34:14+02:00,Affaire Jürgen Conings : un douzième militaire écarté des dépôts d'armes et lieux sensibles,Belga
2021-05-26T10:33:07+02:00,"Iran : le président Rohani demande au Guide suprême plus de ""concurrence"" à l’élection présidentielle",Belga
2021-05-27T20:59:46+02:00,Conflit israélo-palestinien : l'ONU lance une commission d'enquête sur Israël et les territoires,Belga
2021-05-26T12:15:00+02:00,Le vaccin Johnson et Johnson (Janssen) n'est provisoirement plus administré en dessous de 41 ans en Belgique,Johanne Montay
2021-05-26T11:01:45+02:00,"Mons : privé de Doudou, Saint-Georges traque les fuites d'eau pour la SWDE",Pierre Wuidart avec Denis Vanderbrugge
2021-05-26T12:46:38+02:00,Les festivals de musique francophones veulent des précisions avant le 4 juin,Belga
2021-05-26T11:07:37+02:00,Les hébergeurs de migrants sont acquittés par la cour d’appel de Bruxelles,Belga
