time,title,author
2021-05-26T12:34:47+02:00,Alexeï Navalny défend au tribunal ses plaintes contre l’administration pénitentiaire,Belga
2021-05-26T14:09:21+02:00,Techniques de désherbage : on a testé leur ergonomie,Valéry Mahy
2021-05-26T13:13:34+02:00,Accord USA-talibans : les talibans mettent en garde les voisins de l’Afghanistan,Belga
2021-05-26T13:25:20+02:00,Coronavirus : l’EMA se prononcera vendredi sur une autorisation de Pfizer pour les 12-15 ans,Belga
2021-05-26T14:31:48+02:00,"Friends, The Office, Breaking Bad...: les séries emblématiques des années 2000 sont-elles indétrônables ?",Maxime Fettweis
2021-05-26T14:57:08+02:00,Brexit : la Belgique recevra 375 millions d’euros du fonds européen,Belga
2021-05-26T14:42:54+02:00,"Avion Ryanair dérouté : la Biélorussie a agi ""légalement"" affirme le président Loukachenko, la Russie le croit",Belga
2021-05-26T15:25:24+02:00,"Coronavirus et adolescents: ""Les services de pédopsychiatrie sont surchargés, nous devons trier les patients""",RTBF avec Belga
2021-05-26T15:48:56+02:00,"""Je n’étais pas au courant que Jürgen Conings était fiché niveau 3 par l’OCAM"", déclare la ministre Ludivine Dedonder à la Chambre",Africa Gordillo
2021-05-26T16:16:00+02:00,"Des formations avec CDI à la clé chez bpost : ""On veut toucher aussi les demandeurs d'emploi sans diplôme""",S. Mergen 
2021-05-26T16:25:40+02:00,"Coronavirus au Japon: les Jeux olympiques de Tokyo toujours en question, mais pas encore de décision d'annuler",Jean-François Herbecq avec agences
2021-05-26T16:26:00+02:00,Namur : retour confirmé pour les fêtes de Wallonie en septembre 2021,Benjamin Brone
2021-05-26T15:31:16+02:00,Variant indien du coronavirus: un isolement obligatoire en France pour les voyageurs venant du Royaume Uni,Annick Merckx
2021-05-26T16:47:25+02:00,Le nombre de passagers aériens retrouvera son niveau d'avant-crise en 2023,Belga
2021-05-26T16:33:10+02:00,"Amazon va racheter le studio MGM (James Bond) pour 8,45 milliards de dollars",AFP
2021-05-26T16:55:25+02:00,"Elio Di Rupo (PS) : ""La Wallonie peut connaître des jours meilleurs""",Rudy Hermans
2021-05-26T17:15:27+02:00,Zone de police de La Louvière : moins d'accidents routiers en 2020 mais de nombreux problèmes de voisinage,RTBF
2021-05-26T17:28:00+02:00,"La Maison Cauchie, à Etterbeek, bientôt rouverte au public",RTBF avec Agences
2021-05-26T17:55:54+02:00,75 ans de l'immigration italienne : Frédéric François s'est recueilli au Bois-du-Cazier de Marcinelle,RTBF
2021-05-26T17:10:25+02:00,Le comité de concertation s'accorde sur la mise aux enchères des licences 5G,Belga
2021-05-26T17:31:51+02:00,La Fondation contre le cancer satisfaite de l'interdiction de fumer dans les stades,Belga
2021-05-26T18:32:00+02:00,Charleroi : une douche mobile pour les sdfs,Christine Borowiak
2021-05-26T18:00:55+02:00,Etats-Unis: huit personnes tuées dans une fusillade en Californie,Belga
2021-05-26T19:02:57+02:00,La Suisse met fin aux négociations sur ses relations avec l'Union européenne,Belga
2021-05-26T18:11:22+02:00,Livraisons en retard: le litige entre AstraZeneca et la Commission européenne devant la justice,Jean-François Herbecq avec Belga
2021-05-26T19:05:20+02:00,L'allongement du congé de deuil approuvé en commission des Affaires sociales,Belga
2021-05-26T19:43:52+02:00,Le programme Beliris 2020-2022 prévoit 845 millions d'euros d'investissements,Belga
2021-05-26T19:48:40+02:00,"Référé Bruxelles : AstraZeneca a favorisé le marché anglais au préjudice de l'Europe, selon l'Union européenne",Belga
2021-05-26T19:31:16+02:00,Coronavirus : origine du Covid: Biden demande aux services de renseignement un rapport sous 90 jours,Belga
2021-05-26T19:53:06+02:00,Enseignement et développement numérique : les écoles francophones sont-elles bien outillées ?,asbr
2021-05-26T21:09:22+02:00,Un village tchèque à la rescousse de cigogneaux et de leur père,AFP
2021-05-26T20:39:43+02:00,"Inde: le cyclone Yaas frappe les côtes orientales, au moins quatre morts",Belga
2021-05-26T20:37:00+02:00,"Frank Vandenbroucke : ""Il n'y a pas vraiment d'alternative au vaccin Johnson & Johnson pour la vaccination à domicile",A. Lechien
2021-05-26T21:48:49+02:00,Coronavirus : un homme inculpé à Saint-Nicolas pour négationnisme et des menaces envers Marc Van Ranst,Belga
2021-05-26T21:30:19+02:00,Colombie: un mort et un palais de justice brûlé après des affrontements,Belga
2021-05-26T22:13:21+02:00,Le Canada veut envoyer un rover sur la Lune d'ici cinq ans,AFP
2021-05-27T06:11:38+02:00,Vax-a-million: une Américaine devient millionnaire grâce à la loterie mise en place par l'Ohio pour pousser à la vaccination,Belga
2021-05-26T23:42:32+02:00,Coup d'État au Mali  :  le Conseil de sécurité de l'ONU condamne l'éviction des autorités de transition,Belga
2021-05-27T06:20:00+02:00,Biélorussie : où sont passés les opposants du président Loukachenko ?,Matthias Masini
2021-05-27T06:25:21+02:00,"26 cas détectés avec le variant indien, confinement immédiat des 5 millions d'habitants de Melbourne",Belga
2021-05-27T06:47:41+02:00,"L'Enclos des fusillés de Bruxelles, devient dimanche ""Nécropole nationale""",Belga
2021-05-26T22:06:30+02:00,Qui savait quoi concernant Jürgen Conings ? Des informations disponibles mais mal exploitées,Patrick Michalle
2021-05-27T07:00:00+02:00,Un patient aveugle récupère en partie la vue grâce à un virus génétiquement modifié,Johanne Montay
2021-05-27T06:52:41+02:00,"Report du Codeco: ""Le brouillard complet pour l'horeca"", qui réclame de la clarté pour les protocoles",Belga
2021-05-27T06:47:00+02:00,Coronavirus en Belgique le 27 mai 2021: 508 patients en soins intensifs,RTBF
2021-05-27T07:27:41+02:00,"Egouttage, présence de plomb,...: un certificat ""eau"" pour les nouveaux bâtiments en Wallonie",Belga
2021-05-27T07:40:33+02:00,Eruption volcanique en RDC : risque de déstabilisation du gaz sous le lac Kivu,Belga
2021-05-27T07:08:03+02:00,"Eruption volcanique en RDC: évacuation d'une partie de Goma, des dizaines de milliers de gens quittent la ville",Belga
2021-05-27T08:12:25+02:00,"Le premier Code de la route était créé il y a 100 ans en France: en Belgique, un tout nouveau devrait sortir en 2022",X.L.
2021-05-27T08:14:07+02:00,La justice néerlandaise impose à Shell de réduire ses émissions de CO2 de 45% d’ici fin 2030,Belga
2021-05-27T08:33:22+02:00,Recherche de Jurgen Conings: les fouilles reprennent dans le parc national de la Haute Campine,RTBF
2021-05-27T08:14:53+02:00,Le futur téléphérique du Heysel à Bruxelles : le projet n’est pas abandonné,K. F.
2021-05-27T08:17:38+02:00,Covid-19: Sanofi lance les essais à grande échelle de son principal projet de vaccin avec GSK,AFP
2021-05-27T09:05:11+02:00,Ecole des jeunes de l'Union Saint-Gilloise : les enquêteurs au cabinet de l’échevin de Molenbeek Abdellah Achaoui,K. F.
2021-05-27T09:29:36+02:00,Vos photos sur le net scannées et revendues sous forme d'infos aux polices: plainte déposée contre une technologie de reconnaissance faciale,Belga
2021-05-27T09:45:19+02:00,"Denis Ducarme : ""Il va falloir se repencher sur la manière dont fonctionnent les services de renseignements en Belgique""",A.M.
2021-05-27T09:12:19+02:00,"Eruption du volcan Nyiragongo en RDC: des dizaines de milliers de personnes évacuées à Goma, pourquoi on craint un catastrophe majeure",AFP
2021-05-27T09:48:33+02:00,Près d'un quart des décès par cancer pourrait être évité si plus personne ne fumait,Belga
2021-05-25T10:38:25+02:00,Sommet européen : Les 27 ferment l’espace aérien européen aux avions biélorusses et prennent des sanctions,Olivier Hanrion
2021-05-25T10:57:28+02:00,"DPG, dans le viseur d’un ""groupe d’extrême droite néerlandais"" renforce la sécurité dans ses bâtiments",Belga
2021-05-25T10:43:27+02:00,#Investigation : jusqu’où peut mener le complotisme ? Les dangers de ces thèses alternatives,C. Dath et T. Godaert
2021-05-25T11:24:00+02:00,Namur : pas de prime pour le personnel d'entretien sous-traitant de Saint-Luc,Gregory  Fobe
2021-05-25T11:29:00+02:00,"Les agriculteurs s'inquiètent, la paille commence à manquer",Marc Melon
2021-05-25T11:25:23+02:00,Des vaccins contre le coronavirus probablement à la poubelle à cause de la méfiance des Hongkongais,AFP
2021-05-25T11:38:15+02:00,Le Bruxelles d’autrefois en huit vidéos d'archives,K. F.
2021-05-25T12:22:00+02:00,La Louvière : le wifi gratuit se développe et est disponible dans le centre-ville,RTBF
2021-05-25T11:42:04+02:00,Les émissions de CO2 de 150.000 véhicules mesurées au Port d’Anvers dès ce mardi,Belga
2021-05-25T12:28:30+02:00,La BBC ne diffusera plus l’interview controversée de Diana,Belga
2021-05-25T12:33:47+02:00,Pénurie des matières premières: jusqu'à deux ans d'attente pour un nouveau vélo,Benjamin Verpoorten
2021-05-25T13:07:00+02:00,Point sur la vaccination à Bruxelles : l'attention portée sur les personnes sans-abri et les travailleurs du sexe,Tom Denis
2021-05-25T12:56:00+02:00,"Biélorussie: Roman Protassevitch, itinéraire d'un journaliste d'opposition qui n'a connu que le régime de Loukachenko",Jean-François Herbecq
2021-05-25T13:15:00+02:00,"Au fond, le ""conflit"" israélo-palestinien est-il vraiment… un ""conflit""?","Un article Inside de Barbara Boulet, journaliste à la rédaction Info"
2021-05-25T13:31:00+02:00,"Bruxelles: l'arrêt dans le dossier dit ""des hébergeurs de migrants"" sera prononcé mercredi",Belga
2021-05-25T13:50:00+02:00,Le troupeau d'un éléphanteau retrouvé trois ans plus tard grâce à son ADN,Maxime Fettweis
2021-05-25T13:57:00+02:00,"Mons: ""La ducasse ne périra jamais"" ou comment faire vivre le Doudou malgré tout",Maxime Maillet
2021-05-25T13:36:57+02:00,Coronavirus – 50% des Wallons en âge d’être vaccinés ont reçu une première injection,Belga
2021-05-25T14:17:11+02:00,"Le groupe Facebook ""Comme un seul homme derrière Jürgen"" supprimé de la plateforme",A.M.
2021-05-25T13:56:02+02:00,"La Défense fait son mea culpa et détaille les mesures après l’affaire ""Jürgen Conings""",Jean-François Noulet
2021-05-25T14:05:22+02:00,L’action en justice de l’Union Européenne contre AstraZeneca débattue mercredi devant la justice bruxelloise,Belga
2021-05-25T14:52:48+02:00,"L’homme fort du Mali, Assimi Goïta, retire leurs prérogatives aux dirigeants chargés de la transition",Belga
2021-05-25T14:18:19+02:00,Chasse à l’homme en Flandre : Jürgen Conings aurait été aperçu par un élève près d’une école primaire d’Evergem,Belga
2021-05-25T14:33:42+02:00,Volcan Nyiragongo : deux fissures de plusieurs centaines de mètres apparaissent en plein centre de Goma,Belga
2021-05-25T15:01:00+02:00,L'Europe à Bruxelles: la Commission réduira la superficie de bureaux mais ne quittera pas Bruxelles,Belga
2021-05-25T15:13:29+02:00,Coronavirus : Les essais cliniques du vaccin Moderna chez les 12-17 ans très encourageants,Belga
2021-05-25T15:50:36+02:00,Information judiciaire après des tests illégaux réalisés dans deux attractions couvertes à Walibi: le patron du parc reconnaît une maladresse,Hugues Van Peel
2021-05-25T15:45:28+02:00,Accord interprofessionnel 2021-2022 : pas d'accord entre les partenaires sociaux sur la prime corona,Belga
2021-05-25T15:22:52+02:00,"Hommages, commission parlementaire, regrets du Roi, statues : les conséquences en Belgique après la mort de George Floyd",RTBF
2021-05-25T16:45:02+02:00,Un plan de relance post-covid : la ville de Liège prend des accents keynésiens,Michel Gretry
2021-05-25T16:51:21+02:00,"Un sommet entre Joe Biden et Vladimir Poutine aura lieu le 16 juin à Genève, un tête-à-tête dans un climat de tensions",AFP
2021-05-25T15:55:53+02:00,Election présidentielle en Syrie ce mercredi : un scrutin pour asseoir un demi-siècle de pouvoir du camp Assad,AFP
2021-05-23T21:08:28+02:00,"Sahara occidental : le chef du Polisario hors ""de danger""",Belga
2021-05-23T21:57:29+02:00,"Coronavirus en Israël : avec seulement douze cas ces dernières 24 heures, le pays envisage de mettre fin aux restrictions sanitaires",Belga
2021-05-25T16:08:41+02:00,Coronavirus : la Belgique pourrait apporter 4 des 100 millions de doses données par l'UE,Belga
2021-05-23T22:42:21+02:00,Une chaîne de supermarchés russes débarque à Flémalle,Michel Gretry
2021-05-23T23:27:52+02:00,Bruxelles comme vous ne l’avez jamais vue : un film datant de 1908 restauré et colorisé,K. F.
2021-05-23T22:06:07+02:00,Avion dérouté : le sommet de l’UE discutera d'éventuelles sanctions contre le Bélarus,Belga
2021-05-23T22:33:09+02:00,Jürgen Conings introuvable : le trafic ferroviaire brièvement interrompu à Bruxelles-Nord après un signalement du fugitif,Belga
2021-05-24T07:18:22+02:00,Pays-Bas : la vaccination des sans-abris contre le coronavirus débute cette semaine,Belga
2021-05-24T07:27:10+02:00,"États-Unis : près de 150 jeunes arrêtés lors d'une ""beach party"" en Californie",Belga
