text,author,tags,born_date,born_location,image_urls,images
"“The person, be it gentleman or lady, who has not pleasure in a good novel, must be intolerably stupid.”",Jane Austen,"aliteracy,books,classic,humor","December 16, 1775","in Steventon Rectory, Hampshire, The United Kingdom",https://upload.wikimedia.org/wikipedia/commons/thumb/c/cc/CassandraAusten-JaneAusten%28c.1810%29_hires.jpg/200px-CassandraAusten-JaneAusten%28c.1810%29_hires.jpg,"[{'url': 'https://upload.wikimedia.org/wikipedia/commons/thumb/c/cc/CassandraAusten-JaneAusten%28c.1810%29_hires.jpg/200px-CassandraAusten-JaneAusten%28c.1810%29_hires.jpg', 'path': 'full/202f06476c6ec2028a863a18c060034b47f77caa.jpg', 'checksum': '32e019a45a472738ef82f8f1c5aeac41', 'status': 'downloaded'}]"
"“It is our choices, Harry, that show what we truly are, far more than our abilities.”",J.K. Rowling,"abilities,choices","July 31, 1965","in Yate, South Gloucestershire, England, The United Kingdom",https://upload.wikimedia.org/wikipedia/commons/thumb/5/5d/J._K._Rowling_2010.jpg/1280px-J._K._Rowling_2010.jpg,"[{'url': 'https://upload.wikimedia.org/wikipedia/commons/thumb/5/5d/J._K._Rowling_2010.jpg/1280px-J._K._Rowling_2010.jpg', 'path': 'full/67931e69367794fed5aba6adfce69cc8c6a2792b.jpg', 'checksum': 'ed591c7b7e9bf1d935519a56a252a23c', 'status': 'downloaded'}]"
"“I have not failed. I've just found 10,000 ways that won't work.”",Thomas A. Edison,"edison,failure,inspirational,paraphrased","February 11, 1847","in Milan, Ohio, The United States",https://upload.wikimedia.org/wikipedia/commons/thumb/9/9d/Thomas_Edison2.jpg/1280px-Thomas_Edison2.jpg,"[{'url': 'https://upload.wikimedia.org/wikipedia/commons/thumb/9/9d/Thomas_Edison2.jpg/1280px-Thomas_Edison2.jpg', 'path': 'full/78a801fd9256031b7069cf1eb38bb1826aeb58b9.jpg', 'checksum': '35b325c6b3f4d2e6448f7f0df946e79b', 'status': 'downloaded'}]"
“Life is what happens to us while we are making other plans.”,Allen Saunders,"fate,life,misattributed-john-lennon,planning,plans","April 24, 1899",in The United States,https://upload.wikimedia.org/wikipedia/en/thumb/6/66/Saunderspassword52065.jpg/1280px-Saunderspassword52065.jpg,"[{'url': 'https://upload.wikimedia.org/wikipedia/en/thumb/6/66/Saunderspassword52065.jpg/1280px-Saunderspassword52065.jpg', 'path': 'full/66870fc7a3768d97a31863bee79977b03bca1f5e.jpg', 'checksum': 'daffb2c3a8a39269d10634ea8f6e6d70', 'status': 'downloaded'}]"
"“A day without sunshine is like, you know, night.”",Steve Martin,"humor,obvious,simile","August 14, 1945","in Waco, Texas, The United States",https://upload.wikimedia.org/wikipedia/commons/thumb/0/0a/Steve_Martin%2C_2017-08-11.jpg/1280px-Steve_Martin%2C_2017-08-11.jpg,"[{'url': 'https://upload.wikimedia.org/wikipedia/commons/thumb/0/0a/Steve_Martin%2C_2017-08-11.jpg/1280px-Steve_Martin%2C_2017-08-11.jpg', 'path': 'full/c0bc279b04d6c05b50a24cbb9bb309a12f2dbb4d.jpg', 'checksum': 'cedadbae2c90a8845a52746009097e41', 'status': 'downloaded'}]"
"“I may not have gone where I intended to go, but I think I have ended up where I needed to be.”",Douglas Adams,"life,navigation","March 11, 1952","in Cambridge, England, The United Kingdom",https://upload.wikimedia.org/wikipedia/commons/thumb/c/c0/Douglas_adams_portrait_cropped.jpg/1280px-Douglas_adams_portrait_cropped.jpg,"[{'url': 'https://upload.wikimedia.org/wikipedia/commons/thumb/c/c0/Douglas_adams_portrait_cropped.jpg/1280px-Douglas_adams_portrait_cropped.jpg', 'path': 'full/3d8cb6d3ca14d6115009b8f81451a7e8c959ab1c.jpg', 'checksum': 'c7d0eb25865df2a395b9606950bff261', 'status': 'downloaded'}]"
"“Good friends, good books, and a sleepy conscience: this is the ideal life.”",Mark Twain,"books,contentment,friends,friendship,life","November 30, 1835","in Florida, Missouri, The United States",https://upload.wikimedia.org/wikipedia/commons/thumb/0/0c/Mark_Twain_by_AF_Bradley.jpg/1280px-Mark_Twain_by_AF_Bradley.jpg,"[{'url': 'https://upload.wikimedia.org/wikipedia/commons/thumb/0/0c/Mark_Twain_by_AF_Bradley.jpg/1280px-Mark_Twain_by_AF_Bradley.jpg', 'path': 'full/5aa96ae7741a7f449062a8fa21d9ba04be349c10.jpg', 'checksum': '2c8792bf9e2702de215ea8a5099d31fb', 'status': 'downloaded'}]"
“There are only two ways to live your life. One is as though nothing is a miracle. The other is as though everything is a miracle.”,Albert Einstein,"inspirational,life,live,miracle,miracles","March 14, 1879","in Ulm, Germany",https://upload.wikimedia.org/wikipedia/commons/thumb/3/3e/Einstein_1921_by_F_Schmutzer_-_restoration.jpg/1280px-Einstein_1921_by_F_Schmutzer_-_restoration.jpg,"[{'url': 'https://upload.wikimedia.org/wikipedia/commons/thumb/3/3e/Einstein_1921_by_F_Schmutzer_-_restoration.jpg/1280px-Einstein_1921_by_F_Schmutzer_-_restoration.jpg', 'path': 'full/4f5cac5a8fd769e8d99283af96dd5d4f80464d48.jpg', 'checksum': 'feb6831cb8cd65d196be883f73c7f277', 'status': 'downloaded'}]"
“Try not to become a man of success. Rather become a man of value.”,Albert Einstein,"adulthood,success,value","March 14, 1879","in Ulm, Germany",https://upload.wikimedia.org/wikipedia/commons/thumb/3/3e/Einstein_1921_by_F_Schmutzer_-_restoration.jpg/1280px-Einstein_1921_by_F_Schmutzer_-_restoration.jpg,"[{'url': 'https://upload.wikimedia.org/wikipedia/commons/thumb/3/3e/Einstein_1921_by_F_Schmutzer_-_restoration.jpg/1280px-Einstein_1921_by_F_Schmutzer_-_restoration.jpg', 'path': 'full/4f5cac5a8fd769e8d99283af96dd5d4f80464d48.jpg', 'checksum': 'feb6831cb8cd65d196be883f73c7f277', 'status': 'downloaded'}]"
“The world as we have created it is a process of our thinking. It cannot be changed without changing our thinking.”,Albert Einstein,"change,deep-thoughts,thinking,world","March 14, 1879","in Ulm, Germany",https://upload.wikimedia.org/wikipedia/commons/thumb/3/3e/Einstein_1921_by_F_Schmutzer_-_restoration.jpg/1280px-Einstein_1921_by_F_Schmutzer_-_restoration.jpg,"[{'url': 'https://upload.wikimedia.org/wikipedia/commons/thumb/3/3e/Einstein_1921_by_F_Schmutzer_-_restoration.jpg/1280px-Einstein_1921_by_F_Schmutzer_-_restoration.jpg', 'path': 'full/4f5cac5a8fd769e8d99283af96dd5d4f80464d48.jpg', 'checksum': 'feb6831cb8cd65d196be883f73c7f277', 'status': 'downloaded'}]"
“It is better to be hated for what you are than to be loved for what you are not.”,André Gide,"life,love","November 22, 1869","in Paris, France",https://upload.wikimedia.org/wikipedia/commons/thumb/4/42/Andr%C3%A9_Gide.jpg/1280px-Andr%C3%A9_Gide.jpg,"[{'url': 'https://upload.wikimedia.org/wikipedia/commons/thumb/4/42/Andr%C3%A9_Gide.jpg/1280px-Andr%C3%A9_Gide.jpg', 'path': 'full/9be211a3ca54dfab4914b7ac4b09d20c7d75b068.jpg', 'checksum': 'f8b1dcc4795670df77d4d16c8cbd3b3a', 'status': 'downloaded'}]"
"“Imperfection is beauty, madness is genius and it's better to be absolutely ridiculous than absolutely boring.”",Marilyn Monroe,"be-yourself,inspirational","June 01, 1926",in The United States,https://upload.wikimedia.org/wikipedia/commons/thumb/4/4e/Monroecirca1953.jpg/1280px-Monroecirca1953.jpg,"[{'url': 'https://upload.wikimedia.org/wikipedia/commons/thumb/4/4e/Monroecirca1953.jpg/1280px-Monroecirca1953.jpg', 'path': 'full/a5dbd7a02894fea219a7d97d143130925fa63df0.jpg', 'checksum': '22b4c9e294b1e74d03ab6932ca2e93d2', 'status': 'downloaded'}]"
"“The opposite of love is not hate, it's indifference. The opposite of art is not ugliness, it's indifference. The opposite of faith is not heresy, it's indifference. And the opposite of life is not death, it's indifference.”",Elie Wiesel,"activism,apathy,hate,indifference,inspirational,love,opposite,philosophy","September 30, 1928","in Sighet, Romania",https://upload.wikimedia.org/wikipedia/commons/thumb/d/da/ELIE_WIESEL_%285112581267%29.jpg/1280px-ELIE_WIESEL_%285112581267%29.jpg,"[{'url': 'https://upload.wikimedia.org/wikipedia/commons/thumb/d/da/ELIE_WIESEL_%285112581267%29.jpg/1280px-ELIE_WIESEL_%285112581267%29.jpg', 'path': 'full/36c3dfd99042d58abb821a258a40c69d07b68845.jpg', 'checksum': 'f1c127eb37a86924de029e1fa1389058', 'status': 'downloaded'}]"
“A woman is like a tea bag; you never know how strong it is until it's in hot water.”,Eleanor Roosevelt,misattributed-eleanor-roosevelt,"October 11, 1884",in The United States,https://upload.wikimedia.org/wikipedia/commons/thumb/2/22/Eleanor_Roosevelt_portrait_1933.jpg/1280px-Eleanor_Roosevelt_portrait_1933.jpg,"[{'url': 'https://upload.wikimedia.org/wikipedia/commons/thumb/2/22/Eleanor_Roosevelt_portrait_1933.jpg/1280px-Eleanor_Roosevelt_portrait_1933.jpg', 'path': 'full/24594026b2fd1f9f66411dfa09e9ea1dd5ebc57e.jpg', 'checksum': '7a9a703615eef9afddd8b6adb6e84031', 'status': 'downloaded'}]"
"“I like nonsense, it wakes up the brain cells. Fantasy is a necessary ingredient in living.”",Dr. Seuss,fantasy,"March 02, 1904","in Springfield, MA, The United States",https://upload.wikimedia.org/wikipedia/commons/thumb/1/18/Theodor_Seuss_Geisel_%2801037v%29.jpg/1280px-Theodor_Seuss_Geisel_%2801037v%29.jpg,"[{'url': 'https://upload.wikimedia.org/wikipedia/commons/thumb/1/18/Theodor_Seuss_Geisel_%2801037v%29.jpg/1280px-Theodor_Seuss_Geisel_%2801037v%29.jpg', 'path': 'full/efd5db5436af552b4f8a479188b629cdc50e56a2.jpg', 'checksum': '231d2a5d905de0f7c0fa82a569715cd1', 'status': 'downloaded'}]"
"“It is not a lack of love, but a lack of friendship that makes unhappy marriages.”",Friedrich Nietzsche,"friendship,lack-of-friendship,lack-of-love,love,marriage,unhappy-marriage","October 15, 1844","in Röcken bei Lützen, Prussian Province of Saxony, Germany",https://upload.wikimedia.org/wikipedia/commons/thumb/1/1b/Nietzsche187a.jpg/1280px-Nietzsche187a.jpg,"[{'url': 'https://upload.wikimedia.org/wikipedia/commons/thumb/1/1b/Nietzsche187a.jpg/1280px-Nietzsche187a.jpg', 'path': 'full/26865ae85e2ea8c59bce0c9d15077723d6e98c3a.jpg', 'checksum': 'eb98ca312fe6c5210ea081066923940a', 'status': 'downloaded'}]"
"“You may not be her first, her last, or her only. She loved before she may love again. But if she loves you now, what else matters? She's not perfect—you aren't either, and the two of you may never be perfect together but if she can make you laugh, cause you to think twice, and admit to being human and making mistakes, hold onto her and give her the most you can. She may not be thinking about you every second of the day, but she will give you a part of her that she knows you can break—her heart. So don't hurt her, don't change her, don't analyze and don't expect more than she can give. Smile when she makes you happy, let her know when she makes you mad, and miss her when she's not there.”",Bob Marley,love,"February 06, 1945","in Nine Mile, Saint Ann, Jamaica",https://upload.wikimedia.org/wikipedia/commons/thumb/5/5e/Bob-Marley.jpg/1280px-Bob-Marley.jpg,"[{'url': 'https://upload.wikimedia.org/wikipedia/commons/thumb/5/5e/Bob-Marley.jpg/1280px-Bob-Marley.jpg', 'path': 'full/b3b6ae427791b3d6306e28f37221ddf42a4fd313.jpg', 'checksum': '4f75a2ba4581fc752372a2adb7d20e6e', 'status': 'downloaded'}]"
"“One good thing about music, when it hits you, you feel no pain.”",Bob Marley,music,"February 06, 1945","in Nine Mile, Saint Ann, Jamaica",https://upload.wikimedia.org/wikipedia/commons/thumb/5/5e/Bob-Marley.jpg/1280px-Bob-Marley.jpg,"[{'url': 'https://upload.wikimedia.org/wikipedia/commons/thumb/5/5e/Bob-Marley.jpg/1280px-Bob-Marley.jpg', 'path': 'full/b3b6ae427791b3d6306e28f37221ddf42a4fd313.jpg', 'checksum': '4f75a2ba4581fc752372a2adb7d20e6e', 'status': 'downloaded'}]"
"“This life is what you make it. No matter what, you're going to mess up sometimes, it's a universal truth. But the good part is you get to decide how you're going to mess it up. Girls will be your friends - they'll act like it anyway. But just remember, some come, some go. The ones that stay with you through everything - they're your true best friends. Don't let go of them. Also remember, sisters make the best friends in the world. As for lovers, well, they'll come and go too. And baby, I hate to say it, most of them - actually pretty much all of them are going to break your heart, but you can't give up because if you give up, you'll never find your soulmate. You'll never find that half who makes you whole and that goes for everything. Just because you fail once, doesn't mean you're gonna fail at everything. Keep trying, hold on, and always, always, always believe in yourself, because if you don't, then who will, sweetie? So keep your head high, keep your chin up, and most importantly, keep smiling, because life's a beautiful thing and there's so much to smile about.”",Marilyn Monroe,"friends,heartbreak,inspirational,life,love,sisters","June 01, 1926",in The United States,https://upload.wikimedia.org/wikipedia/commons/thumb/4/4e/Monroecirca1953.jpg/1280px-Monroecirca1953.jpg,"[{'url': 'https://upload.wikimedia.org/wikipedia/commons/thumb/4/4e/Monroecirca1953.jpg/1280px-Monroecirca1953.jpg', 'path': 'full/a5dbd7a02894fea219a7d97d143130925fa63df0.jpg', 'checksum': '22b4c9e294b1e74d03ab6932ca2e93d2', 'status': 'downloaded'}]"
"“It takes a great deal of bravery to stand up to our enemies, but just as much to stand up to our friends.”",J.K. Rowling,"courage,friends","July 31, 1965","in Yate, South Gloucestershire, England, The United Kingdom",https://upload.wikimedia.org/wikipedia/commons/thumb/5/5d/J._K._Rowling_2010.jpg/1280px-J._K._Rowling_2010.jpg,"[{'url': 'https://upload.wikimedia.org/wikipedia/commons/thumb/5/5d/J._K._Rowling_2010.jpg/1280px-J._K._Rowling_2010.jpg', 'path': 'full/67931e69367794fed5aba6adfce69cc8c6a2792b.jpg', 'checksum': 'ed591c7b7e9bf1d935519a56a252a23c', 'status': 'downloaded'}]"
"“If you can't explain it to a six year old, you don't understand it yourself.”",Albert Einstein,"simplicity,understand","March 14, 1879","in Ulm, Germany",https://upload.wikimedia.org/wikipedia/commons/thumb/3/3e/Einstein_1921_by_F_Schmutzer_-_restoration.jpg/1280px-Einstein_1921_by_F_Schmutzer_-_restoration.jpg,"[{'url': 'https://upload.wikimedia.org/wikipedia/commons/thumb/3/3e/Einstein_1921_by_F_Schmutzer_-_restoration.jpg/1280px-Einstein_1921_by_F_Schmutzer_-_restoration.jpg', 'path': 'full/4f5cac5a8fd769e8d99283af96dd5d4f80464d48.jpg', 'checksum': 'feb6831cb8cd65d196be883f73c7f277', 'status': 'downloaded'}]"
"“It is impossible to live without failing at something, unless you live so cautiously that you might as well not have lived at all - in which case, you fail by default.”",J.K. Rowling,,"July 31, 1965","in Yate, South Gloucestershire, England, The United Kingdom",https://upload.wikimedia.org/wikipedia/commons/thumb/5/5d/J._K._Rowling_2010.jpg/1280px-J._K._Rowling_2010.jpg,"[{'url': 'https://upload.wikimedia.org/wikipedia/commons/thumb/5/5d/J._K._Rowling_2010.jpg/1280px-J._K._Rowling_2010.jpg', 'path': 'full/67931e69367794fed5aba6adfce69cc8c6a2792b.jpg', 'checksum': 'ed591c7b7e9bf1d935519a56a252a23c', 'status': 'downloaded'}]"
“Logic will get you from A to Z; imagination will get you everywhere.”,Albert Einstein,imagination,"March 14, 1879","in Ulm, Germany",https://upload.wikimedia.org/wikipedia/commons/thumb/3/3e/Einstein_1921_by_F_Schmutzer_-_restoration.jpg/1280px-Einstein_1921_by_F_Schmutzer_-_restoration.jpg,"[{'url': 'https://upload.wikimedia.org/wikipedia/commons/thumb/3/3e/Einstein_1921_by_F_Schmutzer_-_restoration.jpg/1280px-Einstein_1921_by_F_Schmutzer_-_restoration.jpg', 'path': 'full/4f5cac5a8fd769e8d99283af96dd5d4f80464d48.jpg', 'checksum': 'feb6831cb8cd65d196be883f73c7f277', 'status': 'downloaded'}]"
"“To the well-organized mind, death is but the next great adventure.”",J.K. Rowling,"death,inspirational","July 31, 1965","in Yate, South Gloucestershire, England, The United Kingdom",https://upload.wikimedia.org/wikipedia/commons/thumb/5/5d/J._K._Rowling_2010.jpg/1280px-J._K._Rowling_2010.jpg,"[{'url': 'https://upload.wikimedia.org/wikipedia/commons/thumb/5/5d/J._K._Rowling_2010.jpg/1280px-J._K._Rowling_2010.jpg', 'path': 'full/67931e69367794fed5aba6adfce69cc8c6a2792b.jpg', 'checksum': 'ed591c7b7e9bf1d935519a56a252a23c', 'status': 'downloaded'}]"
“Any fool can know. The point is to understand.”,Albert Einstein,"knowledge,learning,understanding,wisdom","March 14, 1879","in Ulm, Germany",https://upload.wikimedia.org/wikipedia/commons/thumb/3/3e/Einstein_1921_by_F_Schmutzer_-_restoration.jpg/1280px-Einstein_1921_by_F_Schmutzer_-_restoration.jpg,"[{'url': 'https://upload.wikimedia.org/wikipedia/commons/thumb/3/3e/Einstein_1921_by_F_Schmutzer_-_restoration.jpg/1280px-Einstein_1921_by_F_Schmutzer_-_restoration.jpg', 'path': 'full/4f5cac5a8fd769e8d99283af96dd5d4f80464d48.jpg', 'checksum': 'feb6831cb8cd65d196be883f73c7f277', 'status': 'downloaded'}]"
“We read to know we're not alone.”,William Nicholson,"misattributed-to-c-s-lewis,reading","January 12, 1948","in Lewes, Sussex, The United Kingdom",https://upload.wikimedia.org/wikipedia/en/thumb/5/5f/Disambig_gray.svg/30px-Disambig_gray.svg.png,"[{'url': 'https://upload.wikimedia.org/wikipedia/en/thumb/5/5f/Disambig_gray.svg/30px-Disambig_gray.svg.png', 'path': 'full/ea9f82b53062c96fa51788ffaf8881801440210b.jpg', 'checksum': '643383a319e93222e2ff9a41801e4680', 'status': 'downloaded'}]"
"“Today you are You, that is truer than true. There is no one alive who is Youer than You.”",Dr. Seuss,"comedy,life,yourself","March 02, 1904","in Springfield, MA, The United States",https://upload.wikimedia.org/wikipedia/commons/thumb/1/18/Theodor_Seuss_Geisel_%2801037v%29.jpg/1280px-Theodor_Seuss_Geisel_%2801037v%29.jpg,"[{'url': 'https://upload.wikimedia.org/wikipedia/commons/thumb/1/18/Theodor_Seuss_Geisel_%2801037v%29.jpg/1280px-Theodor_Seuss_Geisel_%2801037v%29.jpg', 'path': 'full/efd5db5436af552b4f8a479188b629cdc50e56a2.jpg', 'checksum': '231d2a5d905de0f7c0fa82a569715cd1', 'status': 'downloaded'}]"
“It is never too late to be what you might have been.”,George Eliot,inspirational,"November 22, 1819","in South Farm, Arbury Hall, Nuneaton, Warwickshire, The United Kingdom",https://upload.wikimedia.org/wikipedia/commons/thumb/4/48/George_Eliot%2C_por_Fran%C3%A7ois_D%27Albert_Durade.jpg/1280px-George_Eliot%2C_por_Fran%C3%A7ois_D%27Albert_Durade.jpg,"[{'url': 'https://upload.wikimedia.org/wikipedia/commons/thumb/4/48/George_Eliot%2C_por_Fran%C3%A7ois_D%27Albert_Durade.jpg/1280px-George_Eliot%2C_por_Fran%C3%A7ois_D%27Albert_Durade.jpg', 'path': 'full/ada103a6287532723e2e3378f64ead73a677babe.jpg', 'checksum': 'd1b302ede2d1e0d7ebd49be2f7ef1db2', 'status': 'downloaded'}]"
"“If you want your children to be intelligent, read them fairy tales. If you want them to be more intelligent, read them more fairy tales.”",Albert Einstein,"children,fairy-tales","March 14, 1879","in Ulm, Germany",https://upload.wikimedia.org/wikipedia/commons/thumb/3/3e/Einstein_1921_by_F_Schmutzer_-_restoration.jpg/1280px-Einstein_1921_by_F_Schmutzer_-_restoration.jpg,"[{'url': 'https://upload.wikimedia.org/wikipedia/commons/thumb/3/3e/Einstein_1921_by_F_Schmutzer_-_restoration.jpg/1280px-Einstein_1921_by_F_Schmutzer_-_restoration.jpg', 'path': 'full/4f5cac5a8fd769e8d99283af96dd5d4f80464d48.jpg', 'checksum': 'feb6831cb8cd65d196be883f73c7f277', 'status': 'downloaded'}]"
“All you need is love. But a little chocolate now and then doesn't hurt.”,Charles M. Schulz,"chocolate,food,humor","November 26, 1922","in Minneapolis, MN, The United States",https://upload.wikimedia.org/wikipedia/commons/thumb/b/ba/Charles_Schulz_NYWTS.jpg/1280px-Charles_Schulz_NYWTS.jpg,"[{'url': 'https://upload.wikimedia.org/wikipedia/commons/thumb/b/ba/Charles_Schulz_NYWTS.jpg/1280px-Charles_Schulz_NYWTS.jpg', 'path': 'full/916eff659ce2fd996e556c819e898ee7e360364f.jpg', 'checksum': 'fdf3fab6c8b641db6890f3577905f8fc', 'status': 'downloaded'}]"
“I have always imagined that Paradise will be a kind of library.”,Jorge Luis Borges,"books,library","August 24, 1899","in Buenos Aires, Argentina",https://upload.wikimedia.org/wikipedia/commons/thumb/c/c6/Jorge_Luis_Borges.jpg/1280px-Jorge_Luis_Borges.jpg,"[{'url': 'https://upload.wikimedia.org/wikipedia/commons/thumb/c/c6/Jorge_Luis_Borges.jpg/1280px-Jorge_Luis_Borges.jpg', 'path': 'full/ef5af1831ac0d904d865868c96286c2e563916a0.jpg', 'checksum': '69c85031378be43f751eb405236e74f6', 'status': 'downloaded'}]"
“Not all of us can do great things. But we can do small things with great love.”,Mother Teresa,"misattributed-to-mother-teresa,paraphrased","August 26, 1910","in Skopje, Macedonia, the Former Yugoslav Republic of",https://upload.wikimedia.org/wikipedia/commons/thumb/d/d6/Mother_Teresa_1.jpg/1280px-Mother_Teresa_1.jpg,"[{'url': 'https://upload.wikimedia.org/wikipedia/commons/thumb/d/d6/Mother_Teresa_1.jpg/1280px-Mother_Teresa_1.jpg', 'path': 'full/39a39dbbe191b4c895a0428480dc04c29afe7c65.jpg', 'checksum': 'd06c37e01ec8b02673dba0707ac49e1a', 'status': 'downloaded'}]"
"“If you judge people, you have no time to love them.”",Mother Teresa,attributed-no-source,"August 26, 1910","in Skopje, Macedonia, the Former Yugoslav Republic of",https://upload.wikimedia.org/wikipedia/commons/thumb/d/d6/Mother_Teresa_1.jpg/1280px-Mother_Teresa_1.jpg,"[{'url': 'https://upload.wikimedia.org/wikipedia/commons/thumb/d/d6/Mother_Teresa_1.jpg/1280px-Mother_Teresa_1.jpg', 'path': 'full/39a39dbbe191b4c895a0428480dc04c29afe7c65.jpg', 'checksum': 'd06c37e01ec8b02673dba0707ac49e1a', 'status': 'downloaded'}]"
“Beauty is in the eye of the beholder and it may be necessary from time to time to give a stupid or misinformed beholder a black eye.”,Jim Henson,humor,"September 24, 1936","in Greenville, Mississippi, The United States",https://upload.wikimedia.org/wikipedia/commons/thumb/8/82/NHS_Jim_Henson_Display_%28cropped%29.jpg/1280px-NHS_Jim_Henson_Display_%28cropped%29.jpg,"[{'url': 'https://upload.wikimedia.org/wikipedia/commons/thumb/8/82/NHS_Jim_Henson_Display_%28cropped%29.jpg/1280px-NHS_Jim_Henson_Display_%28cropped%29.jpg', 'path': 'full/868aff678483dac8467a713fa1326d96a2fcecd3.jpg', 'checksum': '07ce757470abe38dc4cc72dcbe492ee7', 'status': 'downloaded'}]"
“For every minute you are angry you lose sixty seconds of happiness.”,Ralph Waldo Emerson,happiness,"May 25, 1803","in Boston, Massachusetts, The United States",https://upload.wikimedia.org/wikipedia/commons/thumb/d/d5/Ralph_Waldo_Emerson_ca1857_retouched.jpg/1280px-Ralph_Waldo_Emerson_ca1857_retouched.jpg,"[{'url': 'https://upload.wikimedia.org/wikipedia/commons/thumb/d/d5/Ralph_Waldo_Emerson_ca1857_retouched.jpg/1280px-Ralph_Waldo_Emerson_ca1857_retouched.jpg', 'path': 'full/78a2a1fdfa184c2ba291f6601dca9b3c90974eec.jpg', 'checksum': 'ded7cd8a132dac8a099231676ee1abc2', 'status': 'downloaded'}]"
“Anyone who thinks sitting in church can make you a Christian must also think that sitting in a garage can make you a car.”,Garrison Keillor,"humor,religion","August 07, 1942","in Anoka, Minnesota, The United States",https://upload.wikimedia.org/wikipedia/commons/thumb/4/49/GKpress.jpg/1280px-GKpress.jpg,"[{'url': 'https://upload.wikimedia.org/wikipedia/commons/thumb/4/49/GKpress.jpg/1280px-GKpress.jpg', 'path': 'full/f9b7e8347203f9d65b59b03add415bf15c0ef958.jpg', 'checksum': '0cd9dba5b3fe3e0d0ad4b048d7bdf675', 'status': 'downloaded'}]"
"“I love you without knowing how, or when, or from where. I love you simply, without problems or pride: I love you in this way because I do not know any other way of loving but this, in which there is no I or you, so intimate that your hand upon my chest is my hand, so intimate that when I fall asleep your eyes close.”",Pablo Neruda,"love,poetry","July 12, 1904","in Parral, Chile",https://upload.wikimedia.org/wikipedia/commons/thumb/8/86/Pablo_Neruda_1963.jpg/1280px-Pablo_Neruda_1963.jpg,"[{'url': 'https://upload.wikimedia.org/wikipedia/commons/thumb/8/86/Pablo_Neruda_1963.jpg/1280px-Pablo_Neruda_1963.jpg', 'path': 'full/72bed51fd472f252b14035c7cb8955df75a43559.jpg', 'checksum': '98004eea353fdc8537803fd25f0cc6a9', 'status': 'downloaded'}]"
"“The truth is, everyone is going to hurt you. You just got to find the ones worth suffering for.”",Bob Marley,friendship,"February 06, 1945","in Nine Mile, Saint Ann, Jamaica",https://upload.wikimedia.org/wikipedia/commons/thumb/5/5e/Bob-Marley.jpg/1280px-Bob-Marley.jpg,"[{'url': 'https://upload.wikimedia.org/wikipedia/commons/thumb/5/5e/Bob-Marley.jpg/1280px-Bob-Marley.jpg', 'path': 'full/b3b6ae427791b3d6306e28f37221ddf42a4fd313.jpg', 'checksum': '4f75a2ba4581fc752372a2adb7d20e6e', 'status': 'downloaded'}]"
"“Of course it is happening inside your head, Harry, but why on earth should that mean that it is not real?”",J.K. Rowling,dumbledore,"July 31, 1965","in Yate, South Gloucestershire, England, The United Kingdom",https://upload.wikimedia.org/wikipedia/commons/thumb/5/5d/J._K._Rowling_2010.jpg/1280px-J._K._Rowling_2010.jpg,"[{'url': 'https://upload.wikimedia.org/wikipedia/commons/thumb/5/5d/J._K._Rowling_2010.jpg/1280px-J._K._Rowling_2010.jpg', 'path': 'full/67931e69367794fed5aba6adfce69cc8c6a2792b.jpg', 'checksum': 'ed591c7b7e9bf1d935519a56a252a23c', 'status': 'downloaded'}]"
"“If you can make a woman laugh, you can make her do anything.”",Marilyn Monroe,"girls,love","June 01, 1926",in The United States,https://upload.wikimedia.org/wikipedia/commons/thumb/4/4e/Monroecirca1953.jpg/1280px-Monroecirca1953.jpg,"[{'url': 'https://upload.wikimedia.org/wikipedia/commons/thumb/4/4e/Monroecirca1953.jpg/1280px-Monroecirca1953.jpg', 'path': 'full/a5dbd7a02894fea219a7d97d143130925fa63df0.jpg', 'checksum': '22b4c9e294b1e74d03ab6932ca2e93d2', 'status': 'downloaded'}]"
