time,title,author
2021-05-26T17:55:54+02:00,75 ans de l'immigration italienne : Frédéric François s'est recueilli au Bois-du-Cazier de Marcinelle,RTBF
2021-05-26T16:56:16+02:00,"""On n'est pas des pigeons"" : réagissez en direct",On n'est pas des pigeons
2021-05-26T16:48:00+02:00,Qui savait quoi sur Jürgen Conings ? Des informations disponibles mais mal exploitées,Patrick Michalle
2021-05-26T16:55:25+02:00,"Elio Di Rupo (PS) : ""La Wallonie peut connaître des jours meilleurs""",Rudy Hermans
2021-05-26T12:46:38+02:00,Les festivals de musique francophones veulent des précisions avant le 4 juin,Belga
2021-05-25T17:54:41+02:00,"Stavelot, Trois-Ponts, Malmedy : des projets ""nature"" pour compenser la ligne à haute tension d’Elia",François Braibant
2021-05-25T17:31:00+02:00,"Le CHU Ambroise Paré verse à Médecins sans Frontières les bénéfices du recueil ""Je l'ai lu dans leurs yeux""",RTBF
2021-05-25T17:30:20+02:00,Etats généraux de la police : lancement d'une réflexion pour dessiner les contours de la police du futur,Belga
2021-05-25T18:33:08+02:00,France : quand une mystérieuse agence tente de mobiliser des influenceurs français pour dénigrer le vaccin Pfizer,Pascale Bollekens
2021-05-25T17:56:52+02:00,Ecolo-Groen veut une obligation d'enregistrement et de motivation des contrôles d'identité,Belga
2021-05-25T18:37:35+02:00,L’opération Cimetière : donner une identité à des corps non identifiés inhumés en Belgique,"Jean-François Noulet, avec D. Brichard"
2021-05-25T19:00:44+02:00,"Affaire Jürgen Conings : pour le moment, la police fédérale a recueilli 185 témoignages",Belga
2021-05-25T19:24:36+02:00,Brexit: le commerce entre l'UE et la Grande-Bretagne s'est effondré,Belga
2021-05-25T19:30:00+02:00,"Cyberattaque d’une vaste ampleur en Belgique : des ""suspicions d’espionnage"" coordonné par un Etat étranger",Sébastien Georis
2021-05-25T18:37:00+02:00,Comment les tensions en Biélorussie ont fini par s'inviter à l'intérieur même de l'Union européenne,Jean-François Herbecq
2021-05-25T18:23:13+02:00,"Les Etats-Unis veulent rouvrir à Jérusalem leur consulat auprès des Palestiniens, selon le secrétaire d'Etat américain Antony Blinken",Belga
2021-05-25T20:32:47+02:00,"Jean-Yves Camus (Observatoire des radicalités politiques) : ""Un militaire peut avoir des opinions, fussent-elles extrêmes""",Anne-Sophie Bruyndonckx
2021-05-25T21:35:18+02:00,Coronavirus en Belgique : les mesures de la première phase du plan d'été ont été couchées dans un projet d'arrêté,Belga
2021-05-25T21:36:45+02:00,Le système du Maximum à facturer couvrira les personnes atteintes du covid long,Belga
2021-05-25T22:20:36+02:00,"Seul un très petit nombre de personnes vaccinées sont quand même infectées par le Covid-19, selon une étude américaine",AFP
2021-05-25T22:32:00+02:00,Un berger salué en héros après la course mortelle en Chine,AFP
2021-05-25T23:03:19+02:00,Déclaration fiscale : soyez vigilant pour ne pas passer à côté des réductions possibles,Hugues Angot
2021-05-25T20:06:16+02:00,Affaire Jürgen Conings : le comité R mènera une enquête,Belga
2021-05-25T20:24:43+02:00,Etats-Unis : un blessé dans des coups de feu tirés sur le site de la mort de George Floyd,Belga
2021-05-25T23:11:48+02:00,"La famille de George Floyd appelle à ""protéger les personnes de couleur""",Belga
2021-05-26T06:00:58+02:00,#Investigation: quand le complotisme s’invite en politique,#Investigation
2021-05-25T23:39:57+02:00,L'Irlande rejette la proposition américaine d'un taux d'imposition minimum mondial,Belga
2021-05-26T06:18:45+02:00,Liège : les amendes pour non-respect du couvre-feu jugées irrecevables,Belga
2021-05-26T06:21:23+02:00,Jürgen Conings était dans le collimateur des services de renseignement depuis six ans,Belga
2021-05-26T06:00:00+02:00,Les poupées sourdes d'Anne pour dédramatiser les appareils auditifs chez les plus jeunes,Philippe Herman
2021-05-26T06:40:34+02:00,Un grand jury réuni pour statuer sur un éventuel procès Trump,Belga
2021-05-26T06:12:09+02:00,Mandat d'arrêt dans un Etat américain contre Marilyn Manson pour agression,Belga
2021-05-26T07:01:03+02:00,Coronavirus en Belgique le 26 mai 2021 : une hausse des cas détectés qui n'a rien d'inquiétant,RTBF
2021-05-26T06:55:05+02:00,"Les chimpanzés ont des ""poignées de mains"" propres à leur groupe social, selon une étude belge",Belga
2021-05-26T07:19:46+02:00,Opérateur polyvalent: le Forem et bpost s'associent et proposent une formation menant à un CDI,Belga
2021-05-26T08:28:46+02:00,"Convaincre les hésitants vaccinaux face aux fake news : ""Une course sans fin"", selon Leila Belkhir",X.L.
2021-05-26T08:34:08+02:00,La tortue géante découverte aux Galapagos appartient bien à une espèce déclarée éteinte,AFP
2021-05-26T09:08:49+02:00,Combien de personnes vaccinées contre le Covid-19 dans votre commune ? Voici les derniers chiffres disponibles (cartes interactives),Ambroise Carton
2021-05-26T09:19:06+02:00,Coronavirus: la reprise de l'emploi en Belgique est parmi les plus lentes d'Europe,Belga
2021-05-26T09:28:07+02:00,"Théo Francken : ""Un extrémiste comme Jürgen Conings n’a pas sa place dans l’armée""",A.M.
2021-05-26T09:52:59+02:00,"Italie: trois arrestations après l'accident du téléphérique de Mottarone, les responsables avaient trafiqué le système de freinage",RTBF
2021-05-26T09:55:59+02:00,Chevron : des bouteilles en plastique recyclé et recyclable pour l’eau de Bru,Françoise Dubois
2021-05-26T06:26:27+02:00,"Nouvelle alerte de l'ONU sur un ""risque sérieux de famine"" au Tigré en Ethiopie",Belga
2021-05-26T10:13:00+02:00,A vos maillots ! La baignade au lac de Neufchâteau sera autorisée,Anne Lemaire
2021-05-26T10:16:17+02:00,Revue de presse : les réactions face à l’affaire Jürgen Conings sont-elles insuffisantes ?,La revue de presse de Nicolas Vandenschrick
2021-05-26T10:18:59+02:00,"Eruption volcanique en RDC : toujours de fortes secousses à Goma, au pied du volcan Nyiragongo",Belga
2021-05-26T07:02:55+02:00,La Wallonie débloque 34 millions pour la sécheresse de 2020,Belga
2021-05-26T10:32:00+02:00,Les Flamands moins flamingants qu'on ne le croit,Joyce Azar
2021-05-26T10:26:49+02:00,"Rappel : en démocratie, on ne tue pas ses adversaires",Bertand Henne
2021-05-26T11:01:45+02:00,"Mons : privé de Doudou, Saint-Georges traque les fuites d'eau pour la SWDE",Pierre Wuidart avec Denis Vanderbrugge
2021-05-26T11:07:37+02:00,Les hébergeurs de migrants sont acquittés par la cour d’appel de Bruxelles,Belga
2021-05-26T11:37:00+02:00,Un policier de la zone Bruxelles-Nord a mis fin à ses jours dimanche : un 2e cas en un an,Philippe Carlot et Fabrice Gérard
2021-05-26T11:47:45+02:00,Campagne de vaccination contre le Covid-19 en Belgique : un nouveau record de doses administrées en une semaine,Ambroise Carton
2021-05-26T12:15:00+02:00,Le vaccin Johnson et Johnson (Janssen) n'est provisoirement plus administré en dessous de 41 ans en Belgique,Johanne Montay
2021-05-26T10:01:51+02:00,Asile et migration : l'Onu critique les quarantaines prétextes imposées aux migrants par les pays européens,Belga
2021-05-26T10:33:07+02:00,"Iran : le président Rohani demande au Guide suprême plus de ""concurrence"" à l’élection présidentielle",Belga
2021-05-26T13:13:34+02:00,Accord USA-talibans : les talibans mettent en garde les voisins de l’Afghanistan,Belga
2021-05-26T13:25:20+02:00,Coronavirus : l’EMA se prononcera vendredi sur une autorisation de Pfizer pour les 12-15 ans,Belga
2021-05-26T14:09:21+02:00,Techniques de désherbage : on a testé leur ergonomie,Valéry Mahy
2021-05-26T14:31:48+02:00,"Friends, The Office, Breaking Bad...: les séries emblématiques des années 2000 sont-elles indétrônables ?",Maxime Fettweis
2021-05-26T14:42:54+02:00,"Avion Ryanair dérouté : la Biélorussie a agi ""légalement"" affirme le président Loukachenko, la Russie le croit",Belga
2021-05-26T14:57:08+02:00,Brexit : la Belgique recevra 375 millions d’euros du fonds européen,Belga
2021-05-26T15:25:24+02:00,"Coronavirus et adolescents: ""Les services de pédopsychiatrie sont surchargés, nous devons trier les patients""",RTBF avec Belga
2021-05-26T15:27:28+02:00,Livraisons en retard: le litige entre AstraZeneca et la Commission européenne devant la justice,Jean-François Herbecq et Olivier Hanrion avec Belga
2021-05-26T15:31:16+02:00,Variant indien du coronavirus: un isolement obligatoire en France pour les voyageurs venant du Royaume Uni,Annick Merckx
2021-05-26T15:48:56+02:00,"""Je n’étais pas au courant que Jürgen Conings était fiché niveau 3 par l’OCAM"", déclare la ministre Ludivine Dedonder à la Chambre",Africa Gordillo
2021-05-26T16:09:45+02:00,Un téléphérique sur le plateau du Heysel à Bruxelles : le projet n’est pas abandonné,K. F.
2021-05-26T16:16:00+02:00,"Des formations avec CDI à la clé chez bpost : ""On veut toucher aussi les demandeurs d'emploi sans diplôme""",S. Mergen 
2021-05-26T16:25:40+02:00,"Coronavirus au Japon: les Jeux olympiques de Tokyo toujours en question, mais pas encore de décision d'annuler",Jean-François Herbecq avec agences
2021-05-26T16:26:00+02:00,Namur : retour confirmé pour les fêtes de Wallonie en septembre 2021,Benjamin Brone
2021-05-26T16:47:25+02:00,Le nombre de passagers aériens retrouvera son niveau d'avant-crise en 2023,Belga
2021-05-26T17:10:25+02:00,Le comité de concertation s'accorde sur la mise aux enchères des licences 5G,Belga
2021-05-26T17:15:27+02:00,Zone de police de La Louvière : moins d'accidents routiers en 2020 mais de nombreux problèmes de voisinage,RTBF
2021-05-26T12:34:47+02:00,Alexeï Navalny défend au tribunal ses plaintes contre l’administration pénitentiaire,Belga
2021-05-26T17:28:25+02:00,"La Maison Cauchie, à Ixelles, bientôt rouverte au public",BELGA
2021-05-26T17:31:50+02:00,La Fondation contre le cancer satisfaite de l'interdiction de fumer dans les stades,Belga
2021-05-26T17:44:33+02:00,La VUB demande à des sans-papiers de mettre un terme à leur grève de la faim,BELGA
2021-05-26T17:50:21+02:00,Pinceaux de maquillage: lesquels utiliser ?,On n'est pas des pigeons
2021-05-26T16:33:10+02:00,"Amazon va racheter le studio MGM (James Bond) pour 8,45 milliards de dollars",AFP
2021-05-25T15:50:36+02:00,Information judiciaire après des tests illégaux réalisés dans deux attractions couvertes à Walibi: le patron du parc reconnaît une maladresse,Hugues Van Peel
2021-05-25T17:20:19+02:00,Le groupe Galère réinjecte de l’argent dans le parking Cockerill,Michel Gretry
2021-05-25T15:45:28+02:00,Accord interprofessionnel 2021-2022 : pas d'accord entre les partenaires sociaux sur la prime corona,Belga
2021-05-24T22:53:21+02:00,"Jurgen Conings, symptôme d’une société en colère ?",Hugues Angot
2021-05-24T17:37:00+02:00,Qui veut une assiette à 35.000 euros ? Le temple de la porcelaine de Tournai va fermer ses portes,Pierre Wuidart
2021-05-25T15:22:52+02:00,"Hommages, commission parlementaire, regrets du Roi, statues : les conséquences en Belgique après la mort de George Floyd",RTBF
2021-05-24T17:44:03+02:00,Géorgie : 2000 personnes manifestent contre le projet d’un barrage géant,AFP
2021-05-24T17:25:50+02:00,Ceuta : près d’un millier de migrants mineurs sont toujours dans l’enclave espagnole,Belga
2021-05-24T17:53:02+02:00,Chasse à l’homme en Flandre : une centaine de participants à la troisième marche de soutien à Jürgen Conings,Belga
2021-05-24T18:20:00+02:00,Certificat Covid européen : une ou deux doses de vaccin pour les personnes ayant des anticorps ?,RTBF
2021-05-24T17:43:51+02:00,"Début d’un Sommet européen sous pression, les Européens en quête d’unité sur la scène internationale",Sandro Calderon
2021-05-24T18:38:54+02:00,"Tragédie du téléphérique en Italie : en Belgique, les téléphériques sont contrôlés ""constamment"" nous assure-t-on",B.J. et L.R.
2021-05-24T18:43:31+02:00,Coronavirus à Malte : 70% de la population a reçu la première dose,Belga
2021-05-24T19:01:16+02:00,Eurovision 2021 : le chanteur du groupe italien ne s’est pas drogué,Belga
2021-05-24T19:06:00+02:00,Coronavirus : le prochain comité de concertation reporté au vendredi 4 juin,Belga
2021-05-24T18:12:40+02:00,Coronavirus : la Chine dément que trois de ses chercheurs ont contracté le Covid fin 2019,Belga
2021-05-24T18:30:26+02:00,Le Bélarus expulse l'ambassadeur et tous les diplomates lettons,Belga
2021-05-24T20:44:22+02:00,"Nucléaire iranien : l’accord d’inspection prolongé, sursis d’un mois pour les diplomates",AFP
2021-05-24T20:21:29+02:00,"Conflit israélo-palestinien : Blinken part pour Jérusalem, Ramallah, Le Caire et Amman",Belga
2021-05-24T20:47:07+02:00,Le directeur adjoint du Théâtre de Liège prend la tête du National,Michel Gretry
2021-05-24T21:35:29+02:00,"Avion détourné par le Bélarus : Roman Protassevitch, l’opposant arrêté, est en détention à Minsk",Belga
2021-05-24T21:22:56+02:00,"Vaccination en Belgique : le Conseil Supérieur de la Santé a tranché, ce sera deux doses pour tous",N.J.
2021-05-24T21:43:16+02:00,Côte belge : affluence considérable ce week-end de Pentecôte à la mer,Belga
2021-05-24T21:45:25+02:00,Coronavirus : un groupe d’experts demande un meilleur système de prévention des pandémies,Paul Verdeau
2021-05-24T22:25:15+02:00,Avion dérouté par le Bélarus : l’UE appelle à un blocus de l’espace aérien biélorusse,Belga
2021-05-24T22:18:57+02:00,Coronavirus : Haïti en état d’urgence sanitaire pour huit jours,Belga
2021-05-25T06:05:30+02:00,Sommet européen : les 27 doivent se partager les efforts pour atteindre les objectifs climat de 2030,Sandro Calderon
2021-05-25T06:14:40+02:00,Avion dérouté par le Bélarus : Lufthansa et KLM évitent l’espace aérien bélarusse,Belga
2021-05-25T06:26:39+02:00,Près de 4 Belges sur 10 envisagent un changement de carrière dans les 12 mois,Belga
2021-05-25T06:19:16+02:00,Comeos appelle à élargir l'utilisation des chèques consommation à tous les magasins,Belga
2021-05-25T06:16:52+02:00,"A New York, ""Little Island"", le nouveau parc en lévitation sur l’Hudson",AFP
2021-05-25T06:28:00+02:00,Le Règlement Général de Protection des Données fête son troisième anniversaire,Belga
2021-05-25T07:00:00+02:00,"Un an après le meurtre de George Floyd, Minneapolis panse ses plaies et n'oublie pas",Benoît Feyt
2021-05-25T07:09:00+02:00,Coronavirus en Belgique ce mardi 25 mai 2021 : voici les chiffres,RTBF
2021-05-25T07:04:55+02:00,Le train de nuit entre la Belgique et l'Autriche reprend du service,Belga
2021-05-25T08:22:00+02:00,"Une conseillère du CPAS d'Ath soutient Jürgen Conings sur Facebook, le bourgmestre réagit",D.Vdb.
2021-05-25T07:35:57+02:00,Le bâtiment anversois de DPG Media rouvert après avoir été partiellement évacué,Belga
2021-05-25T08:50:51+02:00,Fusion entre TF1 et M6 : quelles conséquences pour le marché des médias en Belgique ?,RTBF La Première
2021-05-25T07:21:45+02:00,Le CEB sera corrigé par le titulaire,Belga
2021-05-25T09:18:15+02:00,"Plan de relance : ""L’heure de vérité"" pour Elio Di Rupo qui appelle patrons, syndicats et associations à se mobiliser",Africa Gordillo
2021-05-25T10:02:54+02:00,"L’avion détourné par la Biélorussie :  en 1956, l'Etat français détournait l'avion du FLN",A.M. avec M.KH.
2021-05-25T10:10:37+02:00,"Plusieurs compagnies contournent l’espace aérien de la Biélorussie, après les sanctions européennes",AFP
2021-05-25T08:34:00+02:00,"Jurgen Conings : vers une grande ""purge"" dans l'armée ?",Bertand Henne
2021-05-25T10:15:32+02:00,Les producteurs de cresson se réjouissent de la météo pluvieuse,Marc Mélon
2021-05-25T10:11:33+02:00,"Revue de presse : ""Qui peut bien soutenir un terroriste ?""",La revue de presse d'Aline Goncalves
2021-05-25T10:29:56+02:00,"Coronavirus en Belgique : ""si la tendance perdure, on pourra passer sous les 500 patients en soins intensifs à la fin de cette semaine"", selon Yves Van Laethem",A.M.
2021-05-25T10:43:27+02:00,#Investigation : jusqu’où peut mener le complotisme ? Les dangers de ces thèses alternatives,C. Dath et T. Godaert
2021-05-25T09:09:02+02:00,"Nouveau concert test ""debout"" le 12 juin : la Ferme du Biéreau accueillera 300 personnes pour le concert de Saule",A.M.
2021-05-25T11:24:00+02:00,Namur : pas de prime pour le personnel d'entretien sous-traitant de Saint-Luc,Gregory  Fobe
2021-05-25T10:57:28+02:00,"DPG, dans le viseur d’un ""groupe d’extrême droite néerlandais"" renforce la sécurité dans ses bâtiments",Belga
2021-05-25T11:29:00+02:00,"Les agriculteurs s'inquiètent, la paille commence à manquer",Marc Melon
2021-05-25T10:38:25+02:00,Sommet européen : Les 27 ferment l’espace aérien européen aux avions biélorusses et prennent des sanctions,Olivier Hanrion
2021-05-25T11:38:15+02:00,Le Bruxelles d’autrefois en huit vidéos d'archives,K. F.
2021-05-25T11:25:23+02:00,Des vaccins contre le coronavirus probablement à la poubelle à cause de la méfiance des Hongkongais,AFP
2021-05-25T12:22:00+02:00,La Louvière : le wifi gratuit se développe et est disponible dans le centre-ville,RTBF
2021-05-25T12:33:47+02:00,Pénurie des matières premières: jusqu'à deux ans d'attente pour un nouveau vélo,Benjamin Verpoorten
2021-05-25T11:42:04+02:00,Les émissions de CO2 de 150.000 véhicules mesurées au Port d’Anvers dès ce mardi,Belga
2021-05-25T13:07:00+02:00,Point sur la vaccination à Bruxelles : l'attention portée sur les personnes sans-abri et les travailleurs du sexe,Tom Denis
2021-05-25T13:15:00+02:00,"Au fond, le ""conflit"" israélo-palestinien est-il vraiment… un ""conflit""?","Un article Inside de Barbara Boulet, journaliste à la rédaction Info"
2021-05-25T12:56:00+02:00,"Biélorussie: Roman Protassevitch, itinéraire d'un journaliste d'opposition qui n'a connu que le régime de Loukachenko",Jean-François Herbecq
2021-05-25T13:31:00+02:00,"Bruxelles: l'arrêt dans le dossier dit ""des hébergeurs de migrants"" sera prononcé mercredi",Belga
2021-05-25T13:50:00+02:00,Le troupeau d'un éléphanteau retrouvé trois ans plus tard grâce à son ADN,Maxime Fettweis
2021-05-25T13:56:02+02:00,"La Défense fait son mea culpa et détaille les mesures après l’affaire ""Jürgen Conings""",Jean-François Noulet
2021-05-25T12:28:30+02:00,La BBC ne diffusera plus l’interview controversée de Diana,Belga
2021-05-25T13:57:00+02:00,"Mons: ""La ducasse ne périra jamais"" ou comment faire vivre le Doudou malgré tout",Maxime Maillet
2021-05-25T14:17:11+02:00,"Le groupe Facebook ""Comme un seul homme derrière Jürgen"" supprimé de la plateforme",A.M.
2021-05-25T14:18:19+02:00,Chasse à l’homme en Flandre : Jürgen Conings aurait été aperçu par un élève près d’une école primaire d’Evergem,Belga
2021-05-25T14:33:42+02:00,Volcan Nyiragongo : deux fissures de plusieurs centaines de mètres apparaissent en plein centre de Goma,Belga
2021-05-25T14:05:22+02:00,L’action en justice de l’Union Européenne contre AstraZeneca débattue mercredi devant la justice bruxelloise,Belga
2021-05-25T13:36:57+02:00,Coronavirus – 50% des Wallons en âge d’être vaccinés ont reçu une première injection,Belga
2021-05-25T15:01:00+02:00,L'Europe à Bruxelles: la Commission réduira la superficie de bureaux mais ne quittera pas Bruxelles,Belga
2021-05-25T14:52:48+02:00,"L’homme fort du Mali, Assimi Goïta, retire leurs prérogatives aux dirigeants chargés de la transition",Belga
2021-05-25T16:08:41+02:00,Coronavirus : la Belgique pourrait apporter 4 des 100 millions de doses données par l'UE,Belga
2021-05-25T16:45:02+02:00,Un plan de relance post-covid : la ville de Liège prend des accents keynésiens,Michel Gretry
2021-05-25T15:55:53+02:00,Election présidentielle en Syrie ce mercredi : un scrutin pour asseoir un demi-siècle de pouvoir du camp Assad,AFP
2021-05-25T15:13:29+02:00,Coronavirus : Les essais cliniques du vaccin Moderna chez les 12-17 ans très encourageants,Belga
2021-05-24T14:12:37+02:00,"Royaume-Uni : Boris Johnson se mariera en 2022, une première pour un chef de gouvernement britannique en 200 ans",AFP
2021-05-24T10:31:45+02:00,L’interminable ardoise de la société flémalloise Liberty Steel,Michel Gretry
2021-05-24T17:07:56+02:00,"Chasse à l’homme en Flandre pour retrouver Jürgen Conings : ""Toutes les pistes restent envisagées"", affirme le Parquet",Belga
2021-05-25T16:51:21+02:00,"Un sommet entre Joe Biden et Vladimir Poutine aura lieu le 16 juin à Genève, un tête-à-tête dans un climat de tensions",AFP
2021-05-22T23:04:16+02:00,France : la surface du vignoble de Cognac impacté par le gel du mois d’avril,Belga
2021-05-22T22:10:04+02:00,Les réalisateurs de Bad Boys for Life apprennent à des jeunes à filmer avec un smartphone,RTBF avec agences
2021-05-22T21:31:19+02:00,"Jürgen Conings introuvable : la police, la Protection civile et l’armée quittent les abords du parc national",Belga
2021-05-23T00:18:25+02:00,La vente en ligne : se faire livrer en point relais aide à diminuer son empreinte carbone,"Cédric Rifflart, Romain Durenne et Thomas Dechamps, Nesrine Jebali"
2021-05-23T00:29:02+02:00,Eruption du volcan Nyiragongo : la ville de Goma évacuée,Belga
2021-05-23T07:23:52+02:00,"Interview explosive de Lady Di en 1995 : 26 ans plus tard, le journaliste présente ses excuses",AFP
2021-05-23T00:50:47+02:00,Måneskin et l’Italie remportent l’Eurovision 2021,RTBF
2021-05-23T07:52:09+02:00,Coronavirus en Belgique ce dimanche 23 mai : notre pays passe sous le seuil de 1500 personnes hospitalisées,RTBF
2021-05-23T08:06:08+02:00,"Grêlons, pluie glaciale, vents violents : 21 coureurs décèdent lors d’une course de 100 km en Chine",AFP
2021-05-23T10:17:42+02:00,"New York: la nuit, des bénévoles traquent les rats, avec leurs chiens",AFP
2021-05-23T10:21:21+02:00,"Les vaccins Pfizer et AstraZeneca sont efficaces contre le variant indien, selon une étude britannique",Belga
2021-05-23T09:49:58+02:00,"La campagne de vaccination se poursuit, avec des incertitudes à propos des livraisons des vaccins Johnson & Johnson","Jean-François Noulet, avec A. Delvoye"
2021-05-23T10:39:00+02:00,"En RDC, Félix Tshisekedi veut renégocier les contrats miniers : ""A lui de nous montrer qu'il veut changer les choses au bénéfice des Congolais""",Ghizlane Kounda
2021-05-23T10:37:28+02:00,"Walmart, Facebook, Chase... Les entreprises américaines mises face à leurs promesses de lutte contre les discriminations raciales",AFP
2021-05-23T10:49:18+02:00,"Éruption du volcan Nyiragongo en RDC : plusieurs maisons englouties, la ville de Goma épargnée",Belga
2021-05-23T12:02:35+02:00,"Grèce : l’incendie de Geraneia, ""catastrophe écologique immense"", en passe d’être totalement maîtrisé",AFP
2021-05-23T12:07:15+02:00,"France: accusé de viols, Patrick Poivre d'Arvor entendu en audition libre par la police",Belga
2021-05-23T11:31:52+02:00,Bruxelles : le dispositif anti-SDF porte d’Anderlecht est illégal et ne sera pas autorisé par la Région,K. F.
2021-05-23T13:08:15+02:00,"Anak Krakatoa, Nyiragongo, Ontake : les éruptions volcaniques les plus meurtrières de ces dernières années (vidéos)",RTBF avec Agences
2021-05-23T13:08:46+02:00,"Eruption volcanique en RDC: les gorilles et les touristes du parc des Virunga sont ""sains et saufs""",Belga
2021-05-23T12:18:58+02:00,"Coronavirus au Royaume-Uni : un ex-conseiller de Boris Johnson l’accuse d’avoir visé une ""immunité collective""",Belga
2021-05-23T13:55:21+02:00,Action syndicale ce dimanche au Domaine de Chevetogne : entrée gratuite sur fond d’inquiétude,"Jean-François Noulet,  avec L. Matagne et B. Carlier"
2021-05-23T13:52:21+02:00,"120 appartements, 316 chambres d’hôtel, vue sur De Brouckère : quel est ce mégaprojet qui doit voir le jour dans le centre de Bruxelles ?",K. F.
2021-05-23T13:59:04+02:00,Dubaï: des photos présumées de la princesse Latifa publiées sur Instagram,Belga
2021-05-23T15:02:00+02:00,"Kylian Mbappé, Donald Trump et autres indiscrétions : la vidéo d'Emmanuel Macron avec McFly et Carlito est en ligne",M.F.
2021-05-23T15:06:32+02:00,Affaire Jürgen Conings : onze militaires ont été écartés des dépôts d'armes et des informations sensibles,Belga
2021-05-23T15:22:34+02:00,"L’un des membres de Måneskin, vainqueur de l’Eurovision, a-t-il pris de la drogue en direct ? Il va se soumettre à un test",RTBF
2021-05-23T16:12:14+02:00,Deux ours bruns abattus après s’être échappés de leur enclos dans un zoo en Angleterre,Belga
2021-05-23T15:02:46+02:00,Déconfinement en France: la station de La Clusaz a rouvert pour deux jours une partie de son domaine skiable,AFP
2021-05-23T14:19:39+02:00,"Pluie de ""zéro point"", francophonie à l’honneur, 19e place belge et #cokegate : ce qu’il faut retenir de l’Eurovision 2021",M.F.
2021-05-23T16:53:45+02:00,Eruption volcanique en RDC : le volcan Nyiragongo n’était plus surveillé depuis sept mois,Belga
2021-05-23T17:49:00+02:00,La nature reprend ses droits dans l'ancienne carrière de Sebastopol à Bouffioulx,Mathieu Van Winckel
2021-05-23T17:42:47+02:00,Coronavirus : la liste des pays sans restrictions pour l’entrée dans l’UE fixée le 9 juin,Belga
2021-05-23T17:35:28+02:00,Initiation au triathlon à Seraing : 28 débutantes avec comme objectif le triathlon de Bütgenbach en juillet,Françoise Dubois
2021-05-23T19:00:51+02:00,Asile et migration : arrestation d’un trafiquant d’êtres humains présumé à La Panne,Belga
2021-05-23T17:56:47+02:00,Action de solidarité avec la Colombie au Mont des Arts à Bruxelles,Belga
2021-05-23T19:13:56+02:00,"Nucléaire iranien : ""Nous ne savons pas encore si l’Iran est prêt à se conformer à l’accord"", affirme le chef de la diplomatie américaine",Belga
